body,score,id,subreddit,link_id,parent_id,created
I don’t think so because of his motivations. He knows his human body is dead but I don’t think he will identify with the Na’vi,1,kk52qp0,Avatar,t3_1adhvx0,t3_1adhvx0,1706553414.0
He was showing signs in WoW already,1,kk5ln6t,Avatar,t3_1adhvx0,t3_1adhvx0,1706559728.0
"Personally I Wana see him go all ""humans weak, na'vi strong"" and basically go on a murder spree",1,kk6bvui,Avatar,t3_1adhvx0,t3_1adhvx0,1706568625.0
I wonder if this will be his arc going forward.,1,kk88jac,Avatar,t3_1adhvx0,t3_1adhvx0,1706598846.0
Probably. It seems that’s the path that he’s destined to take in the end,1,kp0a7sr,Avatar,t3_1adhvx0,t3_1adhvx0,1707128531.0
"Does Colonel Miles Quaritch deserve redemption after Avatar The Way of Water? Having seen the film myself, I don't think so because this is a clone that has all the memories (except for the final battle) and all the personality of the original Miles. This means that essentially, he is the same person as the original, and had he survived his final battle in the first film, he would have displayed the same redeeming qualities as his clone because they share the exact same personality. The reason why the clone doesn't remember the colonel's final moments is because the memories were downloaded before the final battle, so of course the clone is not going to remember the moments after the memories were extracted. Although the Navi clone may have different personalities, but still has the exact same personality and memories as the original Miles and therefore, we have to assume that any redeeming quality he shows, is something the original Miles would have displayed if he had survived his final battle.",1,kpzlzy7,Avatar,t3_1adhvx0,t3_1adhvx0,1707686183.0
Even Ardmore noticed it in that one deleted scene when she saw his bare and dirty feet.,55,kk1ztmv,Avatar,t3_1adhvx0,t1_kk1d3cc,1706498659.0
“Towards the nearest soul tree” 😭,22,kk3ji89,Avatar,t3_1adhvx0,t1_kk1d3cc,1706532781.0
"There was also that fun scene of him holding his human skull in his hand, then easily crushing it.

Human Quaritch was weak, he lost. Na'vi Quaritch is the new alpha now.",19,kk36g3b,Avatar,t3_1adhvx0,t1_kk1d3cc,1706524656.0
Yeah Quaritch is about to have one of the all-time greatest character arcs in film history,9,kk3w3c7,Avatar,t3_1adhvx0,t1_kk1d3cc,1706538491.0
seeing what happens when quaritch eventually connects to a spirit source is one of the things i’m looking forward to most in the new movies,24,kk3z54q,Avatar,t3_1adhvx0,t1_kk1j437,1706539720.0
"I want to see this so bad. And I think we will. Storytelling-wise, I don't see any other realistic reason to bring Quaritch back in a Na'vi body besides to explore him gaining a different perspective. We're already beginning to see the shift in him after seeing him connect to Spider and seeing Neytiri be the violent, irrational one.",8,kk4wnqt,Avatar,t3_1adhvx0,t1_kk1j437,1706551387.0
real,1,kop5r7w,Avatar,t3_1adhvx0,t1_kk1j437,1706936388.0
I think that's what the ash tribe will be used for. Quaritch ended the movie pretty hurt and not doing so good. I think he's gonna get nursed back to health by the ash tribe and he's gonna start seeing things from a different perspective via them. The ash tribe might potentially be more open technology and change which provides a better entry point for Quaritch to be willing to learn and an easy way for Na'vi to end up fighting other Na'vi.,6,kk4xddn,Avatar,t3_1adhvx0,t1_kk2jtqr,1706551627.0
Neytiri would kill him on sight if she saw him wandering in a forest,24,kk2b90h,Avatar,t3_1adhvx0,t1_kk248v3,1706503820.0
I think it'd be Kiri or even Tuk,6,kk2dbc0,Avatar,t3_1adhvx0,t1_kk248v3,1706504875.0
"FYI, the whole reason they brought Quaritch back in a Na'vi body is because every time they tried to enter Pandora wilderness, they were attacked by the fauna. Humans are viewed as a virus now by Eywa with probably exception of Norm and all them. They used Na'vi bodies to get in undetected and not have every animal attack them.",7,kk4y672,Avatar,t3_1adhvx0,t1_kk303ka,1706551896.0
"ya exactly, he wil never be a human again",1,kop5vs4,Avatar,t3_1adhvx0,t1_kka81cd,1706936456.0
"I don't see how it wouldn't end up like this. He doesn't have a human body to go back to... I guess unless they made grew him one, which is possible, but I very much doubt they will.

So... in a Na'vi body, he would be an outcast on base and couldn't realistically go live back on earth since he can't breath our air.

I for one, can't wait.",1,kk4ywkb,Avatar,t3_1adhvx0,t1_kk4116a,1706552141.0
Yep,9,kk32wks,Avatar,t3_1adhvx0,t1_kk1ztmv,1706521979.0
For a good story all characters have development so hopefully because of her development she brings him in or it’s a step in her development. I think that would be good.,6,kk2clkj,Avatar,t3_1adhvx0,t1_kk2b90h,1706504504.0
Thx for pointing that out I indeed remember this being mentioned although we could argue that Eywa could’ve still not been fooled and that letting him and others leave is only part of a plan. Eywa is conscious and powerful.,1,kkbrb1c,Avatar,t3_1adhvx0,t1_kk4y672,1706653314.0
I love your style!!,17,kgkffbe,Avatar,t3_18zupaf,t3_18zupaf,1704536233.0
![gif](giphy|gKfyusl0PRPdTNmwnD),12,kgn9wgr,Avatar,t3_18zupaf,t3_18zupaf,1704580196.0
Oohhh this has awoken something in me,8,kglkgbf,Avatar,t3_18zupaf,t3_18zupaf,1704558009.0
https://preview.redd.it/ipvhw8ofcwac1.png?width=602&format=pjpg&auto=webp&s=40d6146faa6300b1f65949c09c5af64a98942df2,4,kgna82m,Avatar,t3_18zupaf,t3_18zupaf,1704580315.0
On these?,4,kgkaitu,Avatar,t3_18zupaf,t3_18zupaf,1704532500.0
Just saw ur post on amino,2,kgl8zgn,Avatar,t3_18zupaf,t3_18zupaf,1704553450.0
https://preview.redd.it/qvaahgnesuac1.jpeg?width=1170&format=pjpg&auto=webp&s=6fd78642cb5b78d03fd22d71ab49edd2b84f9c46,1,kgltwov,Avatar,t3_18zupaf,t3_18zupaf,1704561472.0
Gorgeous! 😍😍,1,kgndqbr,Avatar,t3_18zupaf,t3_18zupaf,1704581604.0
What’s OC?,1,kgo84dv,Avatar,t3_18zupaf,t3_18zupaf,1704593227.0
Who is downvoting all of these comments lmfaooo😭😭,1,kgoz6wg,Avatar,t3_18zupaf,t3_18zupaf,1704604968.0
I imagine a night in the bedroom would be would be quite kinky with her,0,kgltxh2,Avatar,t3_18zupaf,t3_18zupaf,1704561480.0
"Wait which one is Klaus? Nice Art though, I like it. 😃👍🏻",0,kglpu6k,Avatar,t3_18zupaf,t3_18zupaf,1704559988.0
Nice 👍🏽,0,kgml4do,Avatar,t3_18zupaf,t3_18zupaf,1704571178.0
I love it and can I ask you a question?,0,kgmofrm,Avatar,t3_18zupaf,t3_18zupaf,1704572383.0
"Go on, what were you gonna say?",1,kgq8k94,Avatar,t3_18zupaf,t3_18zupaf,1704634727.0
noice😏,1,khc37rc,Avatar,t3_18zupaf,t3_18zupaf,1704960110.0
Thanks!!,7,kgkfi0p,Avatar,t3_18zupaf,t1_kgkffbe,1704536291.0
on me 😈 my keyboard was so shocked by this woman that it even decided not to finish my post,7,kgkcy3x,Avatar,t3_18zupaf,t1_kgkaitu,1704534347.0
WHATTAHELL 💔💔💔💔,4,kglusnv,Avatar,t3_18zupaf,t1_kgltwov,1704561791.0
Original character,2,kgp46tv,Avatar,t3_18zupaf,t1_kgo84dv,1704607677.0
Mysterious envious,2,kgp4fih,Avatar,t3_18zupaf,t1_kgoz6wg,1704607819.0
😳😳😳,5,kgluh4e,Avatar,t3_18zupaf,t1_kgltxh2,1704561676.0
"Klaus is my OC, art with him is in my profile (recom with a cap) 🙌
this drawing is a gender bend of Claus into a fem version",1,kglqk4m,Avatar,t3_18zupaf,t1_kglpu6k,1704560252.0
You can💯,2,kgp496z,Avatar,t3_18zupaf,t1_kgmofrm,1704607716.0
😈😈😈😈,2,kglv0gi,Avatar,t3_18zupaf,t1_kgluh4e,1704561869.0
Do you mind if I use her in a story?,1,kgp8jev,Avatar,t3_18zupaf,t1_kgp496z,1704610298.0
"Of course, with me as the author",1,kgp9kmy,Avatar,t3_18zupaf,t1_kgp8jev,1704610958.0
No the character,1,kgpbzsz,Avatar,t3_18zupaf,t1_kgp9kmy,1704612563.0
"Perhaps I don't quite understand you?
If you want to use my character's art for your own purposes, please list me as the author",1,kgpcien,Avatar,t3_18zupaf,t1_kgpbzsz,1704612916.0
I can list you as the creator of the character I'm the author right in the story using the character and plus I'm going to use it on Wattpad a fanfiction story that's what I want to use her for,2,kgpdign,Avatar,t3_18zupaf,t1_kgpcien,1704613604.0
Sure you can if you tag me:) would be happy to get a link to the result in the end,5,kgpe8xd,Avatar,t3_18zupaf,t1_kgpdign,1704614114.0
Also does your character have a name?,2,kgpeebq,Avatar,t3_18zupaf,t1_kgpe8xd,1704614220.0
"His name is Klaus. This art is its female version, so it is unlikely that it would be advisable to use the original name 🤔",3,kgpf6mg,Avatar,t3_18zupaf,t1_kgpeebq,1704614772.0
Can I just give her a name,1,kgpf8uw,Avatar,t3_18zupaf,t1_kgpf6mg,1704614814.0
Yesss,1,kgpfan7,Avatar,t3_18zupaf,t1_kgpf8uw,1704614848.0
What about Ura'ki,2,kgpfgf1,Avatar,t3_18zupaf,t1_kgpfan7,1704614961.0
Or what about Ash,1,kgpfj2q,Avatar,t3_18zupaf,t1_kgpfan7,1704615014.0
"The character used to be human 🤔
 I don't know, if the na'vi-name makes sense, you can call it whatever you want",2,kgpft9x,Avatar,t3_18zupaf,t1_kgpfgf1,1704615214.0
I think I'll just call her Ash,3,kgpfvus,Avatar,t3_18zupaf,t1_kgpft9x,1704615264.0
Do you want the link to my story to where you can see your character?,2,kgt67zz,Avatar,t3_18zupaf,t1_kgpft9x,1704671588.0
I would be happy!,1,kgunobx,Avatar,t3_18zupaf,t1_kgt67zz,1704690322.0
"https://www.wattpad.com/story/359620095?utm_source=android&utm_medium=link&utm_content=share_writing&wp_page=create&wp_uname=SpartanRoyal101&wp_originator=YN7f2tpIybwi9mpG2XrW0cOlcJmNeQNcB3FtxalvIaer4CxTrkqot61VctMG3r8u3%2FTTlsvqiGf0uOx6ws54QV8XEUlk6YoO4CnwGW52YVNdjpWi%2BUZEoM%2FfiIJZ%2Bdtv


Here's the link to the story",2,kgutqns,Avatar,t3_18zupaf,t1_kgunobx,1704693100.0
Do you have the slightest idea how little that narrows it down?,45,jrcpg40,Avatar,t3_14vgf08,t3_14vgf08,1688954596.0
"Honestly I think majority of this already happened in avatar 2. 

Realizing kiri is an important character and that she has a deep bond with eywa, her own vulnerable scenes that showed how her character is quite important to the story.

Multiple times a conflict has caused the family getting kind of torn apart like the last scenes and the first few scenes. 

Although I wonder if it will be far more intense, it is quite interesting.",26,jrcqb64,Avatar,t3_14vgf08,t3_14vgf08,1688955036.0
This is the most excitingly vague quote I've read all day! And I'm here for it!,8,jrdalh1,Avatar,t3_14vgf08,t3_14vgf08,1688966739.0
"Just got a bad feeling about Tuk's future...

![gif](giphy|pDEcq3lHdMLeCg4Htk)",4,jrh11it,Avatar,t3_14vgf08,t3_14vgf08,1689033812.0
Honestly lol,1,jrk7r2s,Avatar,t3_14vgf08,t1_jrdalh1,1689097054.0
I honestly thought she was going to get killed off in the last one.  I figured she’d die in the beginning,1,jrhmhqd,Avatar,t3_14vgf08,t1_jrh11it,1689044001.0
"I wouldn't have watched it if I suspected that. Kids dying hurts me like no other, Neteyam was already too much.",1,jrk7trs,Avatar,t3_14vgf08,t1_jrhmhqd,1689097084.0
I’m just happy it isn’t going to be another 13 years (or atleast I hope it won’t be) until I get to watch what it is becoming one of if not my favorite movie franchises!,92,j2wbrwa,Avatar,t3_1031nkv,t3_1031nkv,1672833161.0
716 days to go :),58,j2wcw3s,Avatar,t3_1031nkv,t3_1031nkv,1672833910.0
"The distance is better. Traditionally releasing a sequel too soon could hurt its box office. Obviously this sort of depends, but avatar films need a wide birth. They are huge event films and audiences need time to 1. See the most recent and 2. Build hype for the next release.",41,j2wfx3y,Avatar,t3_1031nkv,t3_1031nkv,1672835833.0
It sounds a lot closer when you realize it's next year.,25,j2x0ecg,Avatar,t3_1031nkv,t3_1031nkv,1672845751.0
Current reason to keep going: gotta see avatar 3 before I die,19,j2wsj7u,Avatar,t3_1031nkv,t3_1031nkv,1672842373.0
"Keep in mind A2 will stay in the theatres at least till the end of this month, then we'll have the blueray promotional period (which will most likely come out in April), so we can have anywhere from 3 to 6 months of promotion (pre and post).
After that there'll be the promotional period for the Disney+ release, and after all that 2024 will be starting so we'll have the start of A3 pre-promotions.

All in all, 2 years is definitely a long time, but it's not as bad as the completely silent 13 years we just survived",12,j2wmcrr,Avatar,t3_1031nkv,t3_1031nkv,1672839415.0
Honestly only 2 years is pretty quick all things considered.,10,j2wmb3c,Avatar,t3_1031nkv,t3_1031nkv,1672839392.0
"Well, let’s console ourselves with the fact that we’ll have 3 more movies in the series…",8,j2wt3c0,Avatar,t3_1031nkv,t3_1031nkv,1672842622.0
"With Avatar 2 doing so well, I think Jim will be motivated and push A3 out on schedule",6,j2wukj2,Avatar,t3_1031nkv,t3_1031nkv,1672843276.0
"I hope I could forget about avatar until the new movie comes out, but I couldn't forgot the 2009 one since the day I've watched The Way of Water...

![gif](giphy|d2lcHJTG5Tscg)",6,j2ww9t2,Avatar,t3_1031nkv,t3_1031nkv,1672844015.0
OH FOR FU-,2,j2whezp,Avatar,t3_1031nkv,t3_1031nkv,1672836719.0
Plenty of time for rewatches,2,j2wztm1,Avatar,t3_1031nkv,t3_1031nkv,1672845515.0
Current objective: Survive,2,j2y68io,Avatar,t3_1031nkv,t3_1031nkv,1672861452.0
"It really should be released December 20, 2023",0,j2yzr78,Avatar,t3_1031nkv,t3_1031nkv,1672872296.0
It’s next year!,1,j2yjo87,Avatar,t3_1031nkv,t3_1031nkv,1672866305.0
That’s not so bad!,1,j2ypj7y,Avatar,t3_1031nkv,t3_1031nkv,1672868426.0
Nah phuck that,1,j2yqsvh,Avatar,t3_1031nkv,t3_1031nkv,1672868887.0
[removed],1,j2yr6pp,Avatar,t3_1031nkv,t3_1031nkv,1672869027.0
I hope Jake won't be pushed to the sideline again to make room for other characters. That's the only thing I don't like about the sequel.,1,j2yth9g,Avatar,t3_1031nkv,t3_1031nkv,1672869882.0
2 years is very quick and reasonable. Yearly sequels can kill a franchise. Look how quickly Star Wars got burnt out by having movies come out every year.,1,j2z2ut4,Avatar,t3_1031nkv,t3_1031nkv,1672873495.0
"Meh, I'm fine with it. Franchises are so oversaturated now with the cinematic universe chase, that waiting two years is fine.",1,j2z621h,Avatar,t3_1031nkv,t3_1031nkv,1672874748.0
"I think everyone will agree that waiting 2 years is better than waiting 13 years....... That being said I am still surprised that it won't be annual, I thought the sequels were all being filmed at the same time, normally if films get made back-to-back they release annually.",1,j2z8exr,Avatar,t3_1031nkv,t3_1031nkv,1672875680.0
"Two years seems rather reasonable, considering that there was thirteen years between 1 and 2. The only issue is that I’m going to have to be faced with the difficult decision of which big blockbuster I want to see that day, Avatar 3 or Sonic 3 lmao.",1,j2zs17s,Avatar,t3_1031nkv,t3_1031nkv,1672883706.0
It’s set to release on my birthday 😁,1,j2zxf7d,Avatar,t3_1031nkv,t3_1031nkv,1672885943.0
Hope its better than the second,1,j2zzud5,Avatar,t3_1031nkv,t3_1031nkv,1672886974.0
Nooo! I don’t know if I can wait that long.,1,j30idrt,Avatar,t3_1031nkv,t3_1031nkv,1672895837.0
On the trot with maybe?,1,j31d1b4,Avatar,t3_1031nkv,t3_1031nkv,1672917826.0
I know. It's just amazing visuals and it really grabs your attention. It's funny that the first one was made before my nephew was born and now he's 12 and loves it. We have the first one on DVD so he got into it really young. It makes me happy that he's old enough now to appreciate it.,21,j2wcr7e,Avatar,t3_1031nkv,t1_j2wbrwa,1672833822.0
"I'm even more anxious about A4. JC seems pretty confident in saying that audiences aren't ready for 4 and 5. And studio's ""Holy F*ck"" remark is in line with that.",13,j2x6bgc,Avatar,t3_1031nkv,t1_j2wbrwa,1672848113.0
😅 only...,8,j2wfrwi,Avatar,t3_1031nkv,t1_j2wcw3s,1672835746.0
I'll be Back!,6,j2x5pnq,Avatar,t3_1031nkv,t1_j2wcw3s,1672847878.0
"I get that. I was just saying that,  for me personally, I don't want to wait (even though I know I have to). A woman can dream 😁",10,j2wh4xf,Avatar,t3_1031nkv,t1_j2wfx3y,1672836557.0
"I think 2 years is a perfect amount of time to wait. I hate when artists release new projects every year without letting the art set and digest. And as you said, these movies are spectacles that deserve the same treatment of a classic album.",18,j2wq3uo,Avatar,t3_1031nkv,t1_j2wfx3y,1672841256.0
"I definitely agree that movies need distance from each other, but I think that the constant onslaught of franchise movies these days (primarily from DC, Marvel, etc) has numbed people down and 2 years seems like it should be fine.",2,j2xfjwq,Avatar,t3_1031nkv,t1_j2wfx3y,1672851666.0
Nah bro 14 years we waited. And they’re making plenty of money. They should release them sooner once a year.,1,j2yr2ug,Avatar,t3_1031nkv,t1_j2wfx3y,1672868988.0
That’s what I keep telling myself as well lmao.,10,j2xw82j,Avatar,t3_1031nkv,t1_j2x0ecg,1672857800.0
I try to forget it’s 23 months away,2,j2yuqd1,Avatar,t3_1031nkv,t1_j2x0ecg,1672870359.0
"No no no no you gotta see Avatar 3, 4, and 5 atleast",10,j2xbdmo,Avatar,t3_1031nkv,t1_j2wsj7u,1672850079.0
same :D,5,j2wz0mj,Avatar,t3_1031nkv,t1_j2wsj7u,1672845180.0
"It could be in some theaters til the summer, if it manages to last as well as the original",7,j2wvm3h,Avatar,t3_1031nkv,t1_j2wmcrr,1672843732.0
"I hope so. In an interview he said if A2 was a flop, then he won't go through with releasing the others. It said A3 is already done with filming and A4 is still in production.",1,j2ysocs,Avatar,t3_1031nkv,t1_j2wukj2,1672869576.0
"I agree. Waiting a year instead of 2 isn't as nerve wracking lol I get anxious when I want to know more of the story, but have to wait to find out lol",2,j2zcsyl,Avatar,t3_1031nkv,t1_j2yzr78,1672877437.0
"Your post/comment was removed for violating r/Avatar's policies on leaks or spoilers. Leaked content is not permitted on r/Avatar, and plot spoilers should not be included in post titles or without a spoiler tag.",1,j2yt0l0,Avatar,t3_1031nkv,t1_j2yr6pp,1672869703.0
Me too! I just love all of the graphics and the different creatures. I read that James Cameron went to the Mariana Trench for inspiration for the sequels.,5,j2ykiyq,Avatar,t3_1031nkv,t1_j2x6bgc,1672866613.0
Totally agree. Thats prob why i am reading the avatar high ground comic and buying merch. I need more avatar in my life!,3,j2wr74a,Avatar,t3_1031nkv,t1_j2wh4xf,1672841768.0
"It will most likely have a re-release in China, at least, but I feel like that will be more of a domestic promotion, so that's why I haven't put it in my calculations",5,j2ww44z,Avatar,t3_1031nkv,t1_j2wvm3h,1672843948.0
"I seen it last night in IMAX 3D and instantly thought “damn, now I wish they’d release it this December” plus isn’t Avatar: The Seed Bearer in the editing stage at this time too?",1,j2zna9y,Avatar,t3_1031nkv,t1_j2zcsyl,1672881753.0
"Cameron has a serious addiction to water….



^and ^i’m ^all ^for ^it!",3,j2z29rl,Avatar,t3_1031nkv,t1_j2ykiyq,1672873267.0
Challenge level impossible : Company tries not to economically exploit players while making a game about natives resisting economic exploitation,68,k8r4you,Avatar,t3_17sjwxc,t3_17sjwxc,1699683729.0
"I really hope they haven’t done this. Even if they have, I’ll likely still play it but it will probably kill any immersion for me on repeat playthroughs. And with this possibility in my head I am definitely not preordering now, and I’m not even considering buying the ultimate edition until I see how the customization is. If there are micro transactions, then no extra money for you!

EDIT: Spelling, the bane of my existence",77,k8qevsj,Avatar,t3_17sjwxc,t3_17sjwxc,1699669611.0
I hope the skins you can buy aren't just basic color sets but just some out of this world wacky colors and clothing items. I would like to at least change my Ikran's colors to a basic extent.,15,k8qma72,Avatar,t3_17sjwxc,t3_17sjwxc,1699673110.0
"Thats so shitty, the game is already so expensive",14,k8r7pjz,Avatar,t3_17sjwxc,t3_17sjwxc,1699685685.0
"Im fine if it’s just varients, stupid sure, but I’m not going to buy them. I think there will be some good base game options. 

Can you imagine if a Thanator a Toruk mount was locked behind a micro transaction? Then I’d be pissed",38,k8qbh3q,Avatar,t3_17sjwxc,t3_17sjwxc,1699668040.0
not necessarily will you need to buy colours for the ikran it’s probably armour for it you can change the colour after you catch it,9,k8replh,Avatar,t3_17sjwxc,t3_17sjwxc,1699691120.0
"ITT: r/Avatar discovers how shitty the gaming industry is now 

Fuck Ubi's greedy asses but honestly, if they're just cosmetic then what's the issue? I won't be touching them.",7,k8rtige,Avatar,t3_17sjwxc,t3_17sjwxc,1699702676.0
"I had no idea this was a Ubisoft game. The £99 “delux edition” had me sceptical, but now I’m definitely not going to be preordering. Gonna be waiting on reviews instead before grabbing this one!",5,k8ru3xh,Avatar,t3_17sjwxc,t3_17sjwxc,1699703088.0
you may dislike it but it's true to how they do it on Pandora,3,k8rk48b,Avatar,t3_17sjwxc,t3_17sjwxc,1699695392.0
yeaaah. the only reason I haven't pre ordered the gold edition yet is because it's from Ubisoft.😂,3,k8rpdaq,Avatar,t3_17sjwxc,t3_17sjwxc,1699699585.0
It's a Ubisoft game. What did you expect?,3,k8rxskh,Avatar,t3_17sjwxc,t3_17sjwxc,1699705421.0
"Don’t preorder.

Wait until the game comes out and the reviews",3,k8s5qfx,Avatar,t3_17sjwxc,t3_17sjwxc,1699709673.0
Well you are wrong,4,k8rqwu1,Avatar,t3_17sjwxc,t3_17sjwxc,1699700780.0
"Maybe just the same colour for the ads for it? 
For less work?",2,k8rovkj,Avatar,t3_17sjwxc,t3_17sjwxc,1699699189.0
I just hope they won’t. Otherwise I’ll know where to start some shit to make them stop.,2,k8rul0h,Avatar,t3_17sjwxc,t3_17sjwxc,1699703409.0
"If they follow the same trend from their previous games, you'll have the option to either pay money or grind a bit ingame to purchase them.",2,k8s0qg9,Avatar,t3_17sjwxc,t3_17sjwxc,1699707109.0
I don’t so I remember seeing a vid of someone u choose which color during the take flight mission,2,k8scckb,Avatar,t3_17sjwxc,t3_17sjwxc,1699712791.0
"If they do a system like Valhalla where if you collect opals to then buy cosmetics or do side missions for opals then it wouldn't be too bad since you could just grind those for different ikran skins. (Better then just paying extra like odyssey and origins which is an improvement, even though I'd prefer no extra micro transactions at all).

In my opinion even if they do it, I'll still pay for some skins if there not like $20+ for 2 skins largely because its the first avatar game thats completely unique plus I have hope that James Camerons team will at least protest or at least make it accessible through game play instead of only having to pay.",2,k8sew78,Avatar,t3_17sjwxc,t3_17sjwxc,1699713875.0
"My guess is they might do it like far cry. Far cry had a premium currency you can permanently unlock items, but you could also just play the game and buy them once you unlocked them with the in game currency. I think it’ll be like that. Yeah you can either buy it and get it immediately or do a challenge and unlock it that way",2,k8td4ng,Avatar,t3_17sjwxc,t3_17sjwxc,1699726558.0
But aren't you excited for the Laser Ultra Mega Robot Ikran with a +250% to fly speed and RGB wings??,3,k8rqb9s,Avatar,t3_17sjwxc,t3_17sjwxc,1699700320.0
"it will have a shitton of microtransactions, its ubisoft. But as always, when you're used to it, you get good at ignoring it. I played through bot AC Origins and Odyssey and was able to achieve the look i wanted, a good immersion and had a ton of fun even with the whole BUY NOW FOR REAL MONEY shit popping up every 5 Minutes...",1,k8rjqgy,Avatar,t3_17sjwxc,t3_17sjwxc,1699695081.0
"Don't spread around speculation like this, just don't pre-order the game.",1,k8t7tiy,Avatar,t3_17sjwxc,t3_17sjwxc,1699724717.0
It will be riddled with microtransactions,1,k8s9qzf,Avatar,t3_17sjwxc,t3_17sjwxc,1699711593.0
"I don’t want to shit on this game, because I love the idea of an open world Avatar game. But given Ubisoft’s track record, there’s a good chance this is heavily monetized. And not just for cosmetics. Ubisoft has used progression micro transactions before that are literally just there to help you skip the best parts of the game. If this is supposed to be Far Cry with an Avatar skin, then it’s safe to expect some pretty wild monetization schemes. Who knows though. Maybe James Cameron’s involvement could lower this issue, but that’s pretty hopeful thinking. And don’t count on Disney to discourage it either, we all remember Battlefront 2 haha!",1,k8sunwm,Avatar,t3_17sjwxc,t3_17sjwxc,1699720026.0
"AAA gaming a nutshell, don't forget all the XP time modifiers that they will sell to you to past all the grinding",1,k8suoed,Avatar,t3_17sjwxc,t3_17sjwxc,1699720031.0
Yeah I get u but there’s nothing we can do,1,k8szd4g,Avatar,t3_17sjwxc,t3_17sjwxc,1699721712.0
"Me when I see snacks
Give me them",1,k8tbxi1,Avatar,t3_17sjwxc,t3_17sjwxc,1699726148.0
The reason it's the same color everyone got in the videos is cause it's from the same save,1,k8ts200,Avatar,t3_17sjwxc,t3_17sjwxc,1699731716.0
"There is already paints for the Ikran. So I fully expect there to be body paints and Ikran and Direhorse paints, cosmetics such as armors and such, etc.",1,k8uutl7,Avatar,t3_17sjwxc,t3_17sjwxc,1699745066.0
"This game is very similar in mechanics to Valhalla and FC6, so my thought is that you'll find some guy in game that will make you pay in game coin to change it.",1,k8v81hi,Avatar,t3_17sjwxc,t3_17sjwxc,1699750274.0
"Probably they would sell transactions to some cosmetics and skin, but I think the color of the ikran would be some random skin when you do the dedicated mission. I saw a video with the mission of ikran and there were various colors.",1,k8xghgj,Avatar,t3_17sjwxc,t3_17sjwxc,1699798632.0
