body,score,id,subreddit,link_id,parent_id,created
"2-3 years is a perfect time. And we will get a trailer, teasers etc. in like a year. That's not too long.",10,j7wvjoy,Avatar,t3_10y9ezd,t1_j7wu1f0,1675986126.0
"Honestly I kinda wish they keep it, since it allow us to see how deep Neytiri's pain of losing Neteyam's and hate for Quaritch/her trauma by the hands of humans run (given that her dislike for Spider is because of that) but I completely understand why they change it. It would have completely change Neytiri's characther for me (and probably most viewers) in a negative way. It seems like it was a last minute decision, too, and almost made it to the movie.",53,kd6rvdx,Avatar,t3_18hfg1i,t3_18hfg1i,1702480449.0
"I guarantee if they kept this, Neytiri would have gotten way more hate for her treatment of towards Spider. She's already getting some hate from the original sense alone.",15,kd85g05,Avatar,t3_18hfg1i,t3_18hfg1i,1702499358.0
"Interesting to see Quaritch say ""you really gonna kill a kid"" and ""your fight's with me"" when he almost killed Lo'ak in a fit of pain fuelled emotional rage back in the forest to spite Jake.",12,kd9d7ar,Avatar,t3_18hfg1i,t3_18hfg1i,1702516371.0
That stabbing scene was gnarly.,11,kd8ayda,Avatar,t3_18hfg1i,t3_18hfg1i,1702501420.0
What makes you think they changed it?,9,kd66e86,Avatar,t3_18hfg1i,t3_18hfg1i,1702470432.0
"I'M SORRY BUT, THE FUCKING CAPTIONS🤣🤣🤣🤣🤣🤣

I CAN'T😭🤣😭😭🤣😭🤣🤣

![gif](giphy|MESArLMuJ3odWm4IWw)",6,kd99lee,Avatar,t3_18hfg1i,t3_18hfg1i,1702514870.0
"![gif](giphy|zeagxoJrCszY2sku2v)

If spider had a ikran😂😂☹️",4,kdahems,Avatar,t3_18hfg1i,t3_18hfg1i,1702535962.0
Dangnt man I wanted this kept,3,kd8f52v,Avatar,t3_18hfg1i,t3_18hfg1i,1702502976.0
"I'm sorry but I read the captions and started laughing. But in all honesty Neytiri JUST lost her first born son and she absolutely HATES Spider with a passion (not just Spider any sky people, I'm not sure about Max and Ned tho bc Ned did help in the battle in the first movie) and Quaritch tried killing her MATE as well and they killed not only her ikran but her DAD too.

Neytiri has a lot of trauma with the sky people and deserved a lot better, Jake almost died on her and not only was he a sky person and she looked past that fact because he was kind to her and her clan, learned everything about the Na'vi and even after confessing that at first it was just a mission, then he completely disobeyed orders, mated with Neytiri, and fought his own species his trust to her was re-earned.

Quaritch and many other sky people have done nothing but make the Na'vi and Sully families lives a living hell, Neteyam's death was the last straw, he was still a child and Quaritch's men had no remorse killing a child sooo why should she?",3,kdjm9fe,Avatar,t3_18hfg1i,t3_18hfg1i,1702685055.0
For all we know it's most likely still cannon to the franchise even though it's a deleted scene especially with how the film was edited so...,4,kd9vahf,Avatar,t3_18hfg1i,t3_18hfg1i,1702523998.0
They didnt change it thats in the movie,-2,kd6ejkl,Avatar,t3_18hfg1i,t3_18hfg1i,1702474674.0
"Yeah it would change the way I see her most definitely, at least she threw him behind her in the other scene.",10,kd75l31,Avatar,t3_18hfg1i,t1_kd6rvdx,1702485689.0
"But then Spider would get less hate, too.",8,kd94tkq,Avatar,t3_18hfg1i,t1_kd85g05,1702512895.0
Probably.,4,kd85ji6,Avatar,t3_18hfg1i,t1_kd85g05,1702499396.0
But we'll probably also get people who wants her to go through with it.,4,kd86hda,Avatar,t3_18hfg1i,t1_kd85g05,1702499761.0
Exactly any time he said anything about the suli family and killing I say what a hypocrite in this scene.,5,kd9dltm,Avatar,t3_18hfg1i,t1_kd9d7ar,1702516538.0
"He threatened to kill one or more of their kids several times by this point. His men killed Neteyam. And he's about to threaten the whole family just to get Jake to fight him. He's really ""but not my kid"" kind of parent.",5,kdb9a5k,Avatar,t3_18hfg1i,t1_kd9d7ar,1702556870.0
"""Hell yeah"" but seriously it was.",6,kd8cg99,Avatar,t3_18hfg1i,t1_kd8ayda,1702501982.0
"They did actually, we see the one where she cuts his chest in this one she went for his throat even after Kiri was released. She still held Spider.",19,kd6m41z,Avatar,t3_18hfg1i,t1_kd66e86,1702478078.0
"Yeah I have no clue why they don't generate the actual words, they mesh everyone's dialogue together.",4,kd9b26l,Avatar,t3_18hfg1i,t1_kd99lee,1702515482.0
Alright I read it out loud and I sound ridiculous.,3,kd9bbdq,Avatar,t3_18hfg1i,t1_kd99lee,1702515591.0
who is Ned? oh you mean Norm.,1,kdjmhj4,Avatar,t3_18hfg1i,t1_kdjm9fe,1702685153.0
"This one was a deleted scene they thought it was too dark, Neytiri never intended to let Spider go after Kiri was released. She was going to stilt his throat until Jake had to grab the knife from her he kept saying ""baby you don't want to do this""",11,kd6ms3j,Avatar,t3_18hfg1i,t1_kd6ejkl,1702478361.0
Isn't that actually Spider getting away from her tho? Since it seems they used the same scenes for the movie but just cut It. Tho it does seems like that,5,kd7depr,Avatar,t3_18hfg1i,t1_kd75l31,1702488565.0
True. Even though there are still people (specifically TikTok 🙄) that still hate him even after watching this.,9,kd9640u,Avatar,t3_18hfg1i,t1_kd94tkq,1702513429.0
I've seen those too. What they don't realize is the consequences that come with it.,8,kd8aptf,Avatar,t3_18hfg1i,t1_kd86hda,1702501329.0
"I wouldn't say it's that. More him accidentally revealing his hand. He was bluffing every time after the first one. 

The first time he actually tried, despite feeling that rage and pain and wanting to punish Jake, he couldn't.
But he still has to pretend he would. To his team, to the RDA, to his enemies. 

Quaritch hides behind the reputation of the ruthlessness of his human namesake to get people to do what he wants or listen to his orders despite it clashing with his own nature. In this scene, in the original and extended cuts but more in the extended, you can see the mask. And you can see it slipping.",1,kdjtaaw,Avatar,t3_18hfg1i,t1_kd9dltm,1702688131.0
"Yeah, in this one Quaritch lets Kiri go, but once he does, Neytiri just presses the blade to Spider's throat, ready to slice, to Jake and Kiri's shock. Kiri was not only let go and standing right next to her, she was telling her ""Mom, enough"" begging her to stop it and Neytiri is so set on revenge she hisses at her own daughter very violently to stay away. Jake manages to come near her and persuade her to let take the knife. It gets really intense and it got toned down for the theatrical cut, with those seconds being cut. Scene's fully rendered and animated though, it was ready to go.",20,kd6nmp9,Avatar,t3_18hfg1i,t1_kd6m41z,1702478719.0
🤣🤣🤣🤣,2,kda6kqk,Avatar,t3_18hfg1i,t1_kd9bbdq,1702529439.0
"I did mean Norm but I've spelt Ned so many times that auto correct corrected it for me, sorry",2,kdjmn9m,Avatar,t3_18hfg1i,t1_kdjmhj4,1702685221.0
"Hmm? No.
This is a wholly separate scene, they had to animate a whole separate thing between Quaritch shoving Kiri away and the family backing into the water",2,kd947b9,Avatar,t3_18hfg1i,t1_kd7depr,1702512638.0
I thought it was pretty fucked up even before the extended scene,9,kdae80s,Avatar,t3_18hfg1i,t1_kd9640u,1702533849.0
"She would have losed all her children. Kiri, Tuk and Lo'ak see Spider as family, and they would have never forgive her if she had done it.",4,kdch62d,Avatar,t3_18hfg1i,t1_kd8aptf,1702575242.0
"She went ballistic on the already dead human where she repeatedly stabbed him. It showed how she was gone for a little while. I like to think after Jake took the knife from her she had a look on her face saying ""did I actually just do that"" or  something like that. And Quaritch is one to talk. Not minutes later he threatened to kill Jake's entire family.",13,kd757k1,Avatar,t3_18hfg1i,t1_kd6nmp9,1702485552.0
"I don't think so?  I could be wrong,  but seeing the quality of the scene wich may as well have made it to the final cut and looking closely, it seems like pretty much the same scene of the movie.",2,kd9ornk,Avatar,t3_18hfg1i,t1_kd947b9,1702521191.0
"Yeah, actually, that might be also part of the reason it was cut, it makes Quaritch's following dialogue a little weird, like the two wouldn't mesh very well one after the other. Or maybe its just now that Spider's safe he can put the cockyness back on, but it feels off that he would make a taunt like that if a Neytiri that just did that is still within lunging distance. She's not holding her knife anymore but it still feels like pushing your luck.",9,kd78rcj,Avatar,t3_18hfg1i,t1_kd757k1,1702486854.0
"No.
The movie scene went roughly as follows-
Quaritch takes Kiri hostage-
Spider pleads for Quaritch to let Kiri go-
Neytiri hops up and grabs Spider-
Ney demands release of Kiri-
Quaritch denies but is nervous-
Ney prepares to Stab Spider-
Quaritch releases Kiri with a shove-
Ney angrily whips Spider behind her-
Sullys and Spider Back into the water-
-

The cut scene is specifically different because Neytiri keeps ahold of Spider after Quaritch releases Kiri, bringing the knife to Spiders neck- which encourages Quaritch to try redirect her “Your going to kill the boy?” And “Your war is with me!”,, where then Jake calms Neytiri down and takes the Knife from Neytiri.

Not to mention, in the cut scene, Neytiri also hisses at Kiri when Kiri begs her to let Spider go.",2,kd9xvag,Avatar,t3_18hfg1i,t1_kd9ornk,1702525161.0
Exactly that definitely wouldn't mesh well like you said. But I did like that scene and kinda wanted to see what Zoe doing it behind the scenes.,4,kd7u829,Avatar,t3_18hfg1i,t1_kd78rcj,1702494694.0
Also did you see the way Spider looked at her. And I thought Neytiri couldn't get any scarier,4,kd7ukug,Avatar,t3_18hfg1i,t1_kd78rcj,1702494825.0
"I just realized that I worded what I meaned to say completely wrong. I know that how the scene developed in the movie is pretty different from this cut scenes, when I say that ""is pretty much the same scenes of the movie"" I refer to how they probably used most of the exact same footage as this one but cut It/edited and added some things to make it flow better. Does that make sense? Sorry for the confusion!",7,kd9z16m,Avatar,t3_18hfg1i,t1_kd9xvag,1702525704.0
Yes that makes more sense 👌👌,4,kdab1jt,Avatar,t3_18hfg1i,t1_kd9z16m,1702531919.0
"I know Cameron likes to work with the same people a lot of the time but I thought getting Arnold Schwarzenegger to do the voice was a BIT odd.

But I got used to it.

The big dance sequence with Spider and the Recoms was strange as hell though.",96,jnfsg3t,Avatar,t3_144i3pp,t3_144i3pp,1686254080.0
"Tulkun never had a voice or speech like you describe. Some of their vocalizations are subtitled for audience convenience, but that's as far as it goes.",149,jnfn54i,Avatar,t3_144i3pp,t3_144i3pp,1686252078.0
">My 10-year-old says I'm wrong

Your 10 year old is right",125,jnfnm4w,Avatar,t3_144i3pp,t3_144i3pp,1686252254.0
It's always been clicks and whistles,79,jnfowly,Avatar,t3_144i3pp,t3_144i3pp,1686252739.0
"&#x200B;

Nope he had like, papyrus font subtitles I believe",32,jng2uty,Avatar,t3_144i3pp,t3_144i3pp,1686257928.0
"Yeah, the ten year old is right. I saw it in theaters a few times and it was never human speech.",27,jnfwxd5,Avatar,t3_144i3pp,t3_144i3pp,1686255769.0
I see you’ve returned from the Berenstein Realm.,11,jng5z2f,Avatar,t3_144i3pp,t3_144i3pp,1686259086.0
"Seen it in IMAX 3D, it was never human speech",8,jng4qoa,Avatar,t3_144i3pp,t3_144i3pp,1686258625.0
"No, the Tulkun never had a voice.",8,jng5uuq,Avatar,t3_144i3pp,t3_144i3pp,1686259042.0
You def both hallucinated. Or we stumbled upon a Mandela effect parallel universe situation. I remember being annoyed that there WERE subtitles bc Lo’ak doesn’t speak Tulkun sounds.,8,jngqr6z,Avatar,t3_144i3pp,t3_144i3pp,1686267770.0
"Maybe in theaters you were so focused you just understood the meaning and your brain input verbal language that wasn’t there, whereas at home you weren’t as engaged?

Or maybe Eywa was with you in the theater lol",11,jngmqh7,Avatar,t3_144i3pp,t3_144i3pp,1686265863.0
"You were straight trippin', my dude.",6,jnhh7h7,Avatar,t3_144i3pp,t3_144i3pp,1686281257.0
no the tulkun never spoke,5,jngji0s,Avatar,t3_144i3pp,t3_144i3pp,1686264457.0
Maybe you imagined his voice from the subtitles?,4,jngucho,Avatar,t3_144i3pp,t3_144i3pp,1686269722.0
Getting high before the late night showing will do that to you.,3,jni3ii6,Avatar,t3_144i3pp,t3_144i3pp,1686295967.0
Maybe this is a sign of how immersive it was for you in the theater? You gave the tulkun a human voice,4,jngk3yq,Avatar,t3_144i3pp,t3_144i3pp,1686264716.0
"There was no ""human"" Tulkun voice. Just whistles and subtitles.",4,jnglgg8,Avatar,t3_144i3pp,t3_144i3pp,1686265298.0
No he’s only ever had the subtitles and the clicks and whistles,2,jnh51s9,Avatar,t3_144i3pp,t3_144i3pp,1686275325.0
That’s about the goofiest thing I can imagine them doing. The human brain is so funny lmao.,2,jnhg2wk,Avatar,t3_144i3pp,t3_144i3pp,1686280668.0
Idk I never really pictured Quaritch as being a fan of the tango… but it kinda worked,27,jnftijg,Avatar,t3_144i3pp,t1_jnfsg3t,1686254485.0
Honestly arnold should be like leader of the ash people... F u cameron if you dont give arnold a role! :D,2,jnhovlz,Avatar,t3_144i3pp,t1_jnfsg3t,1686285629.0
Yes. This is true,9,jnglrgl,Avatar,t3_144i3pp,t1_jnfn54i,1686265433.0
"Good ol' Papyrus

Don't fix what's not broken",14,jngb5a0,Avatar,t3_144i3pp,t1_jng2uty,1686261049.0
"*BerensSTAIN

/s",4,jng6apl,Avatar,t3_144i3pp,t1_jng5z2f,1686259210.0
Lol apparently.,1,jnhkz37,Avatar,t3_144i3pp,t1_jnhh7h7,1686283311.0
"Well that was a reference to True Lies. So it was like Cameron winking to the audience.

In fact that explains why after Quaritch was done spinning Spider with a rose in his mouth he winked to the camera for a solid five minutes.",12,jnfv03h,Avatar,t3_144i3pp,t1_jnftijg,1686255046.0
"Not this again, Stephen.",6,jnghnty,Avatar,t3_144i3pp,t1_jngb5a0,1686263671.0
"She lost her sister, her father, a close friend (Tsu'tey), she lost na'vi from The People, Seze, another mount (the thanator), her home, the eldest son and her father's bow, but i doubt she will become a villain.",62,kj6c2la,Avatar,t3_19dkoof,t3_19dkoof,1706004336.0
"I don't think villain is the right word here. No longer being a black vs white heroine is a better way to describe it.

Avatar is a rather idealistic (in a good way) black and white conflict between the na'vi and RDA. Having our heroine  repeatedly stabs a pleading man to death makes it hard makes it harder to maintain this attitude (this is why I feel that alternative cut of the stand off was cut).

It does seem like A3 will be adding a lot of grey (on both sides) to the setting and while I do expect Cameron to confront this darkness within Neytiri I suspect she will still come out of it as a pure ""good guy"".",37,kj6d3ji,Avatar,t3_19dkoof,t3_19dkoof,1706005117.0
I don't see it ever happening. She is absolutely 100% clear in her loyalties to the Na'vi and Eywa. Everything she has lost has been at the hands of the RDA. Other than Ronal she has absolutely no real antagonisms with any Na'vi individuals. There's literally no reason I can think of for her to change sides.,7,kj6d3g5,Avatar,t3_19dkoof,t3_19dkoof,1706005115.0
I don't think Neytiri would be a full blown villain. However i do think she would have some internal conflict within herself where she blames herself for everything and makes her do bad things. In the end with help from Jake and the family she would accept what happened and become stronger because of it,3,kj6za35,Avatar,t3_19dkoof,t3_19dkoof,1706017840.0
"I could see it.  She's definitely not processing her grief in a healthy way, and it has the potential to alienate her from the rest of her family and clan.  She could easily end up in a downward spiral of isolation, hate, and vengeance.

Would I defend her?  No.  I feel bad for her, but there's no sense in excusing and enabling destructive behavior.  If she can't or won't let go of her prejudice - even for humans who are on her side - she's just perpetuating the damage that the RDA started.  She's spreading her trauma to people who don't deserve it.

Hopefully her family can get through to her before she's lost.  I'd love to see a long conversation between her and Mo'at where they sort this stuff out.",6,kj8dagn,Avatar,t3_19dkoof,t3_19dkoof,1706035540.0
In humans point of view she already is.,2,kj6d6da,Avatar,t3_19dkoof,t3_19dkoof,1706005176.0
I'm wondering if part of 3 will be Naytiri siding with the ash people in a more ruthless campaign of war,2,kj8datd,Avatar,t3_19dkoof,t3_19dkoof,1706035543.0
"Plot twist: The Fire ~~Nation~~ Na’vi from Avatar 3 is a new clan founded by Neytiri with the sole purpose of eliminating any humans indiscriminately and any Na’vi/Avatars/Recoms that stand in her way. 

I’d frankly love to see that. One thing that seems too unrealistic about Avatar (apart from human single-digits IQ) is that it is too black and white. You have the Na’vi that are *too* good, almost to a fault, and humans who are *too* evil. There’s little grey with only a few good humans and no bad Na’vi (yet). We know that’s not how the world works. You can name any historical civilization, any at all, and you’ll find good things about them, and bad ones. It would be interesting to see her anger get the best of her.",2,kja1gq2,Avatar,t3_19dkoof,t3_19dkoof,1706056241.0
"I don't know about villain, but if she keeps down the path of not treating Spider great, if she ever starts going back to the stuff she did to him in the comics or keeps up the blind hatred toward any and all things human, it could really have the potential to push her toward dark grey for a while, even if she does see the light later and comes back.",3,kj6f387,Avatar,t3_19dkoof,t3_19dkoof,1706006609.0
"It will not happen. But Neytiri as a villain, ally of the RDA, would be disastrous for the clans and the resistance. She knows too much and does too many things.  I digress, but I hope Varang can be like a evil Neytiri",1,kj6ajb9,Avatar,t3_19dkoof,t3_19dkoof,1706003151.0
"Well she's already got a full blown hate boner for the entire human race, would be interesting to see not gona lie, would be quite the twist.

What would be an even bigger twist is if she joined a side that had it in for both na'vi and humans",1,kj6omc4,Avatar,t3_19dkoof,t3_19dkoof,1706012701.0
I highly doubt it will happen. But she’s definitely not gonna be showing any mercy to humans whatsoever. Even if the humans would call it a “war crime”,1,kj82n1v,Avatar,t3_19dkoof,t3_19dkoof,1706032047.0
Supposedly there’s a “sudden hard turn” in either the third or fourth movie. So it wouldn’t surprise me if she turned against Jake or something,1,kj9ig6o,Avatar,t3_19dkoof,t3_19dkoof,1706049134.0
"This is exactly the same characterisation they tried to achieve (and failed spectacularly) with Daenerys in Game of Thrones. They tried to speedrun her villain arc, but ended up showing us on screen she was more or less justified for doing everything she did in the last two episodes.",1,kj9uep2,Avatar,t3_19dkoof,t3_19dkoof,1706053551.0
"I wouldn't think so, even though, considering how much she's lost",1,kjbhigb,Avatar,t3_19dkoof,t3_19dkoof,1706079617.0
"I see her gradually succumbing to her anger and grief over the loss of her son, to the point where she starts to lose her emotional connection to Ewa. If her being pulled towards the villainous side in A3 is part of the movie’s plot, I predict it will involve her allying herself with the Ash People, because she believes them to be the force needed to destroy the RDA and the human colonists they bring to Pandora.",1,kjchgdc,Avatar,t3_19dkoof,t3_19dkoof,1706102892.0
"She lost her sister, father, home, and eldest son. 

AND a big chunk of her family when home tree was destroyed. idk why everyone always leaves that out. we see many omatikaya die in the destruction of home tree. they are her family too",1,kjgm2d5,Avatar,t3_19dkoof,t3_19dkoof,1706158331.0
"“Na’vi” means the people. “She lost the people from the people.” 

Reminds me of that spiderverse scene where he’s pointing out that chai tea means tea tea and naan bread means bread bread.",4,kjdp7hc,Avatar,t3_19dkoof,t1_kj6c2la,1706120503.0
"I mean, she is the face of the franchise, so I doubt they'd mess her up *too* bad. I imagine that she's gonna end up in a dark spot and Jake is gonna have to pull her out from it.",7,kj7i9s7,Avatar,t3_19dkoof,t1_kj6d3ji,1706025092.0
What are you talking about?  OP said nothing about her changing sides and fighting the Na'vi.,2,kj8cjwp,Avatar,t3_19dkoof,t1_kj6d3g5,1706035297.0
"Yea, she's definitely become isolated. Unless I am misremembering I don't she did much of the water stuff. I could see her being pissed at Sully since she was completely right about not running away. If s9mething happens to Jake I can see her going full Kill Bill murder spree.",1,kjd14av,Avatar,t3_19dkoof,t1_kj8dagn,1706110577.0
That’s my theory as well.,1,kjchmgk,Avatar,t3_19dkoof,t1_kj8datd,1706102967.0
"Demigod Kiri, who was born via ""a godess"" giving part of it's life force to a dying human woman, decides to sacrifice herself and ""give back"" said life force to Earth, revealing an endless near-magical substance that revives Earth's resources and gives humanity a future. Bonus points if she turns into a big flowery pod somewhere on Earth that spits out fumes that clear the atmosphere and produce green renewable fuel for Earth's machinery. Boom, everyone is saved, the entire bus claps.",109,j4l7oc6,Avatar,t3_10dfmir,t3_10dfmir,1673879928.0
"My theory for how they could do a happy ending is to have Kiri go to earth and become Earth's Version of Eywa, basically resetting their biosphere and giving the people of earth a second chance but this time living in balance with nature. All the rich elites who move to Pandora so they can live forever in the new colony will be killed but all the poor and destitute on earth will have a second chance at living in paradise. It kind of fits the religious theme of Eywa being God and Kiri is the child born of immaculate conception sent to earth to save the souls of the repentant.",45,j4l7zio,Avatar,t3_10dfmir,t3_10dfmir,1673880067.0
"That's taking things in a very realistic way, which the story isn't bound to follow.  Jim Cameron can do anything he wants with the scripts.

If it were realistic though, I've known for a long time the Na'vi would have been doomed in the long term, colonization or not.

""A rock pile ceases to be a rock pile the moment a single man contemplates it, bearing within him the image of a cathedral.""

The Na'vi will never have that ability (or at least they'll never be able to act on it)- their way and their laws literally ban it.  That by itself means they will never have the power the humans do.  Eventually human creations will become so powerful they will be able to defeat the Na'vi and Pandoran ecosystem with ease, for whatever reason they want.  It may take decades before they really have the means and the motivation to do so, and they can be defeated in individual battles, but eventually the improving technology will be superior to everything on Pandora.",19,j4le1rw,Avatar,t3_10dfmir,t3_10dfmir,1673882697.0
"A technologically inferior force will lose to a technologically superior force every time if the latter is united in purpose. The whole point of the Avatar movies is that you need to somehow convince the button pushers for the empire to stop pushing the buttons, or else literally rebel in an act of violence against the imperial state. That is Jake's arc in the first film, along with Trudy and a few others.

This theme carries over to Avatar 2, too. Look no further than the biologist on the Tulkun whaling ship. Sure, he's there for the science, but he's enabling them, and ultimately is just as culpable as the man firing the harpoon. ""that's why I drink"" is an excuse that holds no water.

The solution is to pierce the veil of the frontier, and I have to imagine that's where the sequels are going to go.",16,j4lno8v,Avatar,t3_10dfmir,t3_10dfmir,1673886520.0
"It was made clear way back in the first film that public back home is very explicitly against heavy handed approach to Na'vi

RDA gets away with it because Pandora far away and they control most of the information that people receive and even then it's still not a guarantee that they will keep being able to do whatever they want because information always gets out one way or another

I mean, can you imagine what kind of PR spin is fed to masses back home by RDA advertising department? 

People on Earth probably think that RDA and Na'vi spend their days holding hands around the campfire and smoking peace pipes",11,j4mne5y,Avatar,t3_10dfmir,t3_10dfmir,1673899808.0
