body,score,id,subreddit,link_id,parent_id,created
One thing I felt is they changed their skin colour between films and made the luminous spots on their skin more prominent.,224,jsd5dcs,Avatar,t3_152b0vi,t3_152b0vi,1689625137.0
"I think one of the reasons might be to create easier scale for scenes with human characters. I think for Na'vi and Avatar characters they just added around 1m to their real life height (idk how many feet it is).

 They are still tall but in the first movie it was more breath taking. Spider now looks super tall next to them compared how small was Grace when Jake carried her.",750,jsd155n,Avatar,t3_152b0vi,t3_152b0vi,1689623509.0
Bring back the original heights.,454,jscwd8j,Avatar,t3_152b0vi,t3_152b0vi,1689621672.0
"This graphic is very incorrect though bc in the OG Avatar clearly showed neytiri much shorter than Jake in EVERY scene. There was a visible height difference. At LEAST a five inch differential. So they COULDNT both be 10 feet tall.

Given that, I doubt the height difference in the new movie is any different. Once again Jake is taller than neytiri. Tonowari is 10 feet. And he’s not THAT much taller than Jake. So this graphic just gets everything wrong lol the og movie heights aren’t to scale and the way of water heights are super inaccurate",106,jsd9hv6,Avatar,t3_152b0vi,t3_152b0vi,1689626696.0
"To make them seem more vulnerable to humanity, and more empathetic too. Since a human spent a lot of time around the Na'vi in Avatar 2, James Cameron was worried the 10 foot tall Na'vi would look to large and alien to the average viewer. Hence, he scaled them down. 

(all speculation. I have no fuckin idea why the shrunk the navi)",263,jscxskn,Avatar,t3_152b0vi,t3_152b0vi,1689622209.0
"I wonder what height would Grace be in Twow, she was 10ft tall in the first movie, she was like the tallest Avatar",62,jsd50dp,Avatar,t3_152b0vi,t3_152b0vi,1689625002.0
Were the 10ft heights actually canon,73,jscyqha,Avatar,t3_152b0vi,t3_152b0vi,1689622571.0
"They are still pretty big, look at the scenes with spider and quaritch, spider is 6ft",15,jsd6n9e,Avatar,t3_152b0vi,t3_152b0vi,1689625610.0
Simple explanation: They didn't change their heights.,55,jsd4bcc,Avatar,t3_152b0vi,t3_152b0vi,1689624733.0
I was wondering this too. When she's holding Jake and putting his mask on she looks massive compared to him I just thought maybe Spider was just a big kid,26,jsd5dv8,Avatar,t3_152b0vi,t3_152b0vi,1689625143.0
They shrunk in the water.,27,jsd2r2m,Avatar,t3_152b0vi,t3_152b0vi,1689624129.0
"https://preview.redd.it/dhqmk515elcb1.jpeg?width=1242&format=pjpg&auto=webp&s=c39f40b5400165e467eaf1393481a1666c96b80d

look how tall lo’ak is compared to spider",19,jsdf6c6,Avatar,t3_152b0vi,t3_152b0vi,1689628891.0
Shortened by parental stress /j,8,jsecsqy,Avatar,t3_152b0vi,t3_152b0vi,1689643743.0
"Spider, I'd assume",22,jsd0rqb,Avatar,t3_152b0vi,t3_152b0vi,1689623364.0
"I don’t think Spider s good as a reference as he's taller than the average human at 16 ( due to Pandora and The Quargenes-- His father was tall ) and he still has some growing to do.

But yea i dont really know why the heights were changed. Maybe because in this movie we spend more time with the Na'vi than the humans ?",15,jsdnj19,Avatar,t3_152b0vi,t3_152b0vi,1689632305.0
They also appear to have been more blue too.,7,jsdq2vo,Avatar,t3_152b0vi,t3_152b0vi,1689633401.0
"Well it removes a lot of potential crotch shots when humans are in a shot with Navis, so there's that. Also it's just makes it way more believable than blue giants juking missiles and weaving through the brush and branches, it's Pandora not a Godzilla world",6,jse633d,Avatar,t3_152b0vi,t3_152b0vi,1689640574.0
"Making them shorter? I can forgive that, but making Neytiri smaller than Tsyeyk? Nah, that's too much.",27,jsd3stg,Avatar,t3_152b0vi,t3_152b0vi,1689624531.0
"The real life reason is likely because there’s a LOT more closed in mo-cap sets, like the cell with Spider and Quaritch. Having the Navi too tall would make shooting the closed in shots more difficult.",11,jsdhs4u,Avatar,t3_152b0vi,t3_152b0vi,1689629941.0
"https://preview.redd.it/85e9t29udlcb1.jpeg?width=1242&format=pjpg&auto=webp&s=fe200f0ecb00afa8d109aa512aa7ca636d499db3

kiri is much taller than spider in this particular scene",15,jsdexw0,Avatar,t3_152b0vi,t3_152b0vi,1689628799.0
"Idk but i think it’s stupid, their height is part of what makes them iconic",10,jsd4xyx,Avatar,t3_152b0vi,t3_152b0vi,1689624976.0
"Personally, i have noticed no difference between two movies.

Avatars still feel enormous in size compared to humans. It could've been just an artistic or technical choice. Maybe they modeled all the scenes, but it turned out that they were a bit smaller than expected, and they had to downscale avatars a bit.

It doesn't matter honestly because it's not noticeable at all unless you're an avatar nerd analyzing every single frame.",14,jsd8lt1,Avatar,t3_152b0vi,t3_152b0vi,1689626359.0
"https://i.redd.it/6rzgbugqnmcb1.gif

!!!",4,jsedw0f,Avatar,t3_152b0vi,t3_152b0vi,1689644236.0
Did Neytiri and Jake get less blue?,5,jsez8bz,Avatar,t3_152b0vi,t3_152b0vi,1689655340.0
They also lost colour they arent blue anyblue they are blue-grey,4,jsfxm09,Avatar,t3_152b0vi,t3_152b0vi,1689680957.0
"https://preview.redd.it/uleq10sralcb1.jpeg?width=1136&format=pjpg&auto=webp&s=8cc3c308d0aa43e86ec52436b28bdde3782f9db2

I’m pretty sure they did! Because look, none of these people seem to be at belly button level with any of the na’vi, and you can’t tell me they’re all shorter than Spider.",13,jsdcglo,Avatar,t3_152b0vi,t3_152b0vi,1689627831.0
They also seemingly change the skin tone a bit,3,jsdtbne,Avatar,t3_152b0vi,t3_152b0vi,1689634800.0
I am also curious about why they lighten the color of them,3,jsek3ur,Avatar,t3_152b0vi,t3_152b0vi,1689647205.0
All things considered I never noticed them being shorter in TWOW.,3,jsgg4u1,Avatar,t3_152b0vi,t3_152b0vi,1689690039.0
"It may have been more practical for the actors considering that Spider is in a lot of scenes in this movie with other Na’vi. 

Personally, I think the change in height is symbolic of how we (the human audience) are growing closer to these characters who we relate and sympathise with. 

The Na’vi are becoming closer to the humans in this story both diplomatically and now ‘physically in terms of height’!

I really hope in the future movies there will be a diplomatic solution to the conflict that Jake and Grace intended in the first movie.",4,jshd6q6,Avatar,t3_152b0vi,t3_152b0vi,1689703189.0
I mean Tonowari is pretty close to 10 feet (9'7 if I remember correctly),3,jsdlw9h,Avatar,t3_152b0vi,t3_152b0vi,1689631614.0
They're different blues too,3,jseffq8,Avatar,t3_152b0vi,t3_152b0vi,1689644969.0
What does James Cameron have to say about it??,3,jsel5vz,Avatar,t3_152b0vi,t3_152b0vi,1689647735.0
Is it possible that only the numbers were changed and not the actual height?,3,jsg6vip,Avatar,t3_152b0vi,t3_152b0vi,1689685863.0
"Could be because Spider’s (fucking hate that dude) body has acclimated to the planet, maybe the foods are more nutrient dense? Idk just a shot in the dark",5,jsdnbbs,Avatar,t3_152b0vi,t3_152b0vi,1689632212.0
"I thought they were the same and people just guessed wrong that they were 10ft tbh. 😅 like its just how they range, like humans. where most humans are between 5-6ft average, they’d be from 8.5-10ft average.. like Grace, norm, and Tonowari are huge but Jake, Neytiri, and Tsu’tey are smaller


And for other comments I know spiders supposed to be like this massive kid cause of the gravity on pandora, so I ignore his height size in comparison since he is bigger than an avg human",6,jsdnkwd,Avatar,t3_152b0vi,t3_152b0vi,1689632328.0
I fucking knew it. Everyone was telling me I was dumb and ignorant.,6,jsdntrb,Avatar,t3_152b0vi,t3_152b0vi,1689632433.0
"Pretty sure that they've always been nine feet ish. During the way of water, when you see humans walking beside or standing beside na'vi, they're ALWAYS much taller and the same as the first movie. I think the scene with Spider was because of standing positions/Spider on uneven terrain. The majority of na'vi Spider is around are also young teenagers/children.",3,jseahf4,Avatar,t3_152b0vi,t3_152b0vi,1689642671.0
Osteoporosis and other nutrient deficiencies. The sequel takes place later than the original film and it took so long for James Cameron to make and fund it so they lost some height due to the actors and script writers not getting paid enough to eat well since the last film was released. 🤭,2,jsf6qjs,Avatar,t3_152b0vi,t3_152b0vi,1689660381.0
"So I’m just looking this up and I remember Disney World Pandora park has their old official height displayed on a wall (indicating they’re 10ft)

https://preview.redd.it/5k2wt6fybxnb1.jpeg?width=1400&format=pjpg&auto=webp&s=b173f3578c9f4e969d2db1a5dcd3a67429aed984

So I guess they have to change that now to their new official height lol.",2,k0ce225,Avatar,t3_152b0vi,t3_152b0vi,1694567795.0
"How come they did't hire Smurfs to play the part of the blue people I'm calling smurf on this, this is smurfing smurf smurf for smurf sake.",2,kbq0qim,Avatar,t3_152b0vi,t3_152b0vi,1701547919.0
survival guide gives a height of 8-10 feet. With a max of 12’10. Jake was always shorter than average in terms of height anyway,3,jsd95co,Avatar,t3_152b0vi,t3_152b0vi,1689626565.0
Is there a lore reason why their skin looks so pale and desaturated?,2,jsdbjew,Avatar,t3_152b0vi,t3_152b0vi,1689627472.0
"They shrunk the na'vis, made them look soft...",2,jse19uf,Avatar,t3_152b0vi,t3_152b0vi,1689638341.0
Because they knew the sequel would never measure up,3,jseu5ri,Avatar,t3_152b0vi,t3_152b0vi,1689652388.0
Bring back their original heights and skin colors :( (omatikaya looks pale blue in a2),2,jsfy5ao,Avatar,t3_152b0vi,t3_152b0vi,1689681269.0
The first movie was so much better than this one. Looked better too. This one looked so fake,3,jsez39g,Avatar,t3_152b0vi,t3_152b0vi,1689655254.0
Shrinkflation,2,jsdh1vm,Avatar,t3_152b0vi,t3_152b0vi,1689629640.0
Probably because they don't want Kiri and Spider look too awkward together,1,jsd9e53,Avatar,t3_152b0vi,t3_152b0vi,1689626657.0
they are getting old.,1,jsdgeg2,Avatar,t3_152b0vi,t3_152b0vi,1689629375.0
Love to see Neytiri taller than Jake for some reason,1,jsdtz4f,Avatar,t3_152b0vi,t3_152b0vi,1689635090.0
Total white washing,1,jsgcx8s,Avatar,t3_152b0vi,t3_152b0vi,1689688627.0
I think I know where the confusion is coming from lmao. The guy who plays Spider is OVER six feet tall and jacked as fuck. You just think he is small. You can see a picture of him standing next to James Cameron somewhere on the subreddit and he looks like he dwarfs James.,1,jsgetqs,Avatar,t3_152b0vi,t3_152b0vi,1689689458.0
Gravity makes you shrink a bit each year. There was 12 years between movies...,-5,jsd5oqu,Avatar,t3_152b0vi,t3_152b0vi,1689625256.0
[deleted],1,jsdjj8b,Avatar,t3_152b0vi,t3_152b0vi,1689630647.0
Shrink ray.,1,jsdmhih,Avatar,t3_152b0vi,t3_152b0vi,1689631861.0
I like to think that They are 10 feet tall and always have been,1,jslme29,Avatar,t3_152b0vi,t3_152b0vi,1689780200.0
"I feel like they had to in a way, Tonowari is around 10ft in the movie, and if they were 10ft or near that Tonotwari would have to be like 13ft and i don’t know if they wanted that😅",1,jsn7u9i,Avatar,t3_152b0vi,t3_152b0vi,1689801595.0
"There is a scene when Lo’ak puts his foot up on a whole human sized table like it’s a foot stool 😂 and both Lo’ak and  Neteyam are shorter than Jake and Neyteri so I feel like they are still so incredibly tall. Even if some sources say that they were 10ft and now they are 8-9ft, I feel like that doesn’t translate to the screen cause they still appear giant in any scene with humans. The best example is when Neyteri picks up a grown man that’s still stuck onto her arrow and uses that same arrow to shoot another.  She looks ginormous lol.",1,jsrdniy,Avatar,t3_152b0vi,t3_152b0vi,1689876517.0
Do Na’vi sweat?,1,jss45nt,Avatar,t3_152b0vi,t3_152b0vi,1689886483.0
Probably so Disney can hire actors to dress up as them at Animal Kingdom 😶,1,junricm,Avatar,t3_152b0vi,t3_152b0vi,1691090034.0
"Lots of time in the sun, and little to no sunscreen lol",74,jsf1ve9,Avatar,t3_152b0vi,t1_jsd5dcs,1689657013.0
Its just better CGI.,23,jsibz9n,Avatar,t3_152b0vi,t1_jsd5dcs,1689716570.0
"The colour of their skin is not about movie but about the light, in the forest it was darker but on the beach there's more light.",22,jsml398,Avatar,t3_152b0vi,t1_jsd5dcs,1689793167.0
I thought they looked darker,11,jshwild,Avatar,t3_152b0vi,t1_jsd5dcs,1689710506.0
"Here’s a question that only JUST popped in my head; so Spider was an baby born(?) on Pandora, and Pandora has lower gravity than Earth, how would that affect his growth? Would he grow taller on Pandora than he would’ve if he’d grown up on Earth? 

That could explain why Spider looks taller than the other humans did in the first movie…if we didn’t know that the Na’vi have been shortened (grrr). The one scene in the first movie that I personally enjoy for the depiction of the height difference is where Neytiri finds Jake’s unconscious human body after killing Quaritch; she’s so big and cradling little Jake in her arms as they reaffirm they’re love for each other.",164,jseje4s,Avatar,t3_152b0vi,t1_jsd155n,1689646854.0
Still jack champion isnt short at 6'3,67,jsdccwo,Avatar,t3_152b0vi,t1_jsd155n,1689627791.0
1 metre is 3 feet and 4 inches,63,jsd1k09,Avatar,t3_152b0vi,t1_jsd155n,1689623669.0
"I agree, the scene where Grace looks ridiculously huge compared to the humans in the camp had me pick up my jaw off the floor and I want that again",313,jsda63u,Avatar,t3_152b0vi,t1_jscwd8j,1689626952.0
[removed],197,jsd7wxm,Avatar,t3_152b0vi,t1_jscwd8j,1689626091.0
Not that much of a difference,1,kelpm9p,Avatar,t3_152b0vi,t1_jscwd8j,1703337041.0
Tonowari is 9'7 as per the visual dictionary,24,jsdkela,Avatar,t3_152b0vi,t1_jsd9hv6,1689630995.0
"In Canon Jake is also below average height so it makes sense that his Avatar would also be below average height, but Neyteri doesn't make sense beyond trying to make it more visually aesthetic when her and Jake are in scene together",20,jsea751,Avatar,t3_152b0vi,t1_jsd9hv6,1689642534.0
I just made the graphic based on the info I found.,6,jsdlfm7,Avatar,t3_152b0vi,t1_jsd9hv6,1689631422.0
"> James Cameron was worried the 10 foot tall Na'vi would look to large and alien to the average viewer.

But that's the point of aliens! They are aliens!",60,jse3j5d,Avatar,t3_152b0vi,t1_jscxskn,1689639363.0
"In Avatar 1, adult Humans look like kids next to the Na'vi. Theres a scene at the start of the movie that shows them together.",31,jsdfuvm,Avatar,t3_152b0vi,t1_jscxskn,1689629158.0
"Could be because of motion cap in the second movie, having them smaller maybe made it easier",52,jsd9758,Avatar,t3_152b0vi,t1_jscxskn,1689626583.0
They should look large and alien 😭,5,jsfy972,Avatar,t3_152b0vi,t1_jscxskn,1689681332.0
Pretty sure they were always 9 ft tall.,72,jsd1sxf,Avatar,t3_152b0vi,t1_jscyqha,1689623765.0
Are you saying that they just retconned their height being that tall?,5,jsdl61y,Avatar,t3_152b0vi,t1_jsd4bcc,1689631312.0
"I mean, Spider IS 6 foot even so he is pretty tall",23,jsdcia6,Avatar,t3_152b0vi,t1_jsd5dv8,1689627850.0
"Lmao, every guy knows a lot about water shrinkage",12,jsdl33s,Avatar,t3_152b0vi,t1_jsd2r2m,1689631277.0
[removed],0,jsd24rx,Avatar,t3_152b0vi,t1_jsd0rqb,1689623891.0
"Stephen Lang is 5'10. Not really ""tall"".",1,jseoh5s,Avatar,t3_152b0vi,t1_jsdnj19,1689649379.0
And let's not forget that Spider is a tall human.,16,jse2xky,Avatar,t3_152b0vi,t1_jsdexw0,1689639089.0
I’m pretty sure they did that to have them look less blue than the Metkayina,4,jsfbcrm,Avatar,t3_152b0vi,t1_jsez8bz,1689663900.0
"Color didn't change, the lighting did",5,jse05tl,Avatar,t3_152b0vi,t1_jsdtbne,1689637844.0
Same. I like the deep blue from 2009. Maybe to more easily distinguish the Omatikaya from the Metkayina,5,jsfbtx5,Avatar,t3_152b0vi,t1_jsek3ur,1689664275.0
"That’s really deep, I like it",2,jshzt5z,Avatar,t3_152b0vi,t1_jshd6q6,1689711814.0
"Well, currently the official height for Neytiri is 8’7, but in 2009, according to WetaFX, the people who made Neytiri in cgi, she’s 9’10",1,jsfbscn,Avatar,t3_152b0vi,t1_jsel5vz,1689664240.0
"I don’t think so, because these CGI companies make sure that height is actually correct. Norm In his human body is 6’2, and Jake still towers over him a lot. Norm is probably a bit under jakes belly button in 2009, but twow, spider is above jakes belly button",2,jsgs769,Avatar,t3_152b0vi,t1_jsg6vip,1689694937.0
"Pandora has lower gravity than Earth, which is more conducive to taller stature.",8,jse3jv9,Avatar,t3_152b0vi,t1_jsdnbbs,1689639373.0
It’s the other way around!! They’re dumb and ignorant,0,jse5ur6,Avatar,t3_152b0vi,t1_jsdntrb,1689640464.0
"Yea, but Neytiri is 9’10 in avatar 2009, and she’s 8’7 in TWOW",1,jsefz21,Avatar,t3_152b0vi,t1_jseahf4,1689645216.0
They definitely do. This is more proof to everyone who doesn’t believe their heights changed that there is a difference,1,k0momai,Avatar,t3_152b0vi,t1_k0ce225,1694737473.0
different settings with different lighting,7,jsdgecf,Avatar,t3_152b0vi,t1_jsdbjew,1689629373.0
"In terms of vfx, this is much better, so I disagree with you on that part, but this movie was a bit slower",3,jsfbewk,Avatar,t3_152b0vi,t1_jsez39g,1689663948.0
"Who deprived your smooth brain of oxygen? The first one looks like a fucking video game compared to way of water, you loser.",2,jsg3y1y,Avatar,t3_152b0vi,t1_jsez39g,1689684424.0
True,2,jsdlcrk,Avatar,t3_152b0vi,t1_jsd9e53,1689631389.0
But that goes for the average N’avi height also. It went from an average of 10 feet to around 8-9,3,jsdkqsz,Avatar,t3_152b0vi,t1_jsdgeg2,1689631135.0
"But officially their heights did change, back in 2009, Neytiri was 9’10. Now she’s 8’7. I’m not using spider as a source, I just meant that as something that got me to research the heights",2,jsgqt72,Avatar,t3_152b0vi,t1_jsgetqs,1689694395.0
"Exactly. The official heights changed. This comes from multiple sources from back in 2009 to now. The original sources and info from 2009 say that Jake and Neytiri are both 10 feet tall. But if you use sources and info from today, they apperently are 8’11 and 8’7",1,jsdkno9,Avatar,t3_152b0vi,t1_jsdjj8b,1689631098.0
Water shrinkage😳,1,jsdmpe6,Avatar,t3_152b0vi,t1_jsdmhih,1689631954.0
"And we're comparing new humans to old humans, we gotta wait till like, Selfridge gets back to we can compare that height, heck I don't even think we got a scene with Max or Norm standing next to a Na'vi or human",1,kauh2vw,Avatar,t3_152b0vi,t1_jsrdniy,1701014027.0
Same,1,kh86yk2,Avatar,t3_152b0vi,t1_jshwild,1704904994.0
"It would effect blood circulation, physical fitness, height, muscle mass, bone density, etc. Some ""good"", but mostly bad.

Humans are pretty specifically adapted for earth, and spending prolonged periods in space can be devastating (with milder effects for low gravity).",85,jsf377w,Avatar,t3_152b0vi,t1_jseje4s,1689657901.0
I heard that actually lower gravity would make you smaller. Due to reasons like less dense air which means you have less breathable air and also since gravity is weaker you need less power to navigate through it.,18,jsfus1h,Avatar,t3_152b0vi,t1_jseje4s,1689679235.0
If anything he'd probably be smaller/weaker because his body is pushing against lesser forces as you'd get on earth.,4,jsgbdfe,Avatar,t3_152b0vi,t1_jseje4s,1689687935.0
We literally see him next to normal humans and he’s just the height of a normal human adolescent what are you talking about,1,k05m3od,Avatar,t3_152b0vi,t1_jseje4s,1694461903.0
He’s 6’3?? I don’t know why I assumed he was at most 5’8,23,jse9fvy,Avatar,t3_152b0vi,t1_jsdccwo,1689642172.0
Good bot,8,jsfte1x,Avatar,t3_152b0vi,t1_jsd1k09,1689678330.0
"All I wanna do, is see her turn into, a GIANT WOMAN",48,jsf3a4h,Avatar,t3_152b0vi,t1_jsda63u,1689657955.0
And able to more easily win when fighting against humans,35,jse4nmn,Avatar,t3_152b0vi,t1_jsd7wxm,1689639893.0
"At the end of the day all that matters is the heights in the movie. Visually Jake stands taller than neytiri by a lot and that scale is the same in both films. Jake is easily over nine feet tall.

Also worth saying they STILL tower over humans. They don’t look that much smaller lol this is crazy drastic and we would notice a dramatic difference such as this",24,jsem08n,Avatar,t3_152b0vi,t1_jsea751,1689648159.0
Jakes avatar wasn’t his. It was his brother’s so the height would be related at all,1,jsfj9hu,Avatar,t3_152b0vi,t1_jsea751,1689670456.0
Yeah no hate.,2,jsfcure,Avatar,t3_152b0vi,t1_jsdlfm7,1689665095.0
"I dunno if youve seen the Na'vi, but they are basically just people. Got human teeth and everything",23,jse6wli,Avatar,t3_152b0vi,t1_jse3j5d,1689640964.0
Yeah I know,8,jsdgiqf,Avatar,t3_152b0vi,t1_jsdfuvm,1689629424.0
"I mean you can just look at pictures of Robert Wadlow next to his father (around 5 ft 10 in to 6 ft) to see what a 9 foot tall man should look like

Compare that to shots in the first avatar where adult males appear to barely reach navel-height to most Avatars

Robert Wadlows father cleared his son’s navel at least, if only barely

This still appears to be the case for Quaritch when he’s standing next to Ardmore and the other humans when’s he’s at HQ

I don’t think the scale is wrong, just the stated NUMBER",36,jsd4tt6,Avatar,t3_152b0vi,t1_jsd1sxf,1689624932.0
"No, they were originally 10 feet tall in 2009. Multiple sources talking about their height way back in 2009 say they’re both 10 feet tall. They were recently changed to 8’11 and 8’7 in twow",4,jsdkyjk,Avatar,t3_152b0vi,t1_jsd1sxf,1689631223.0
I'm saying Jake and Neytiri never were the height some say they were in A1.,5,jshuocw,Avatar,t3_152b0vi,t1_jsdl61y,1689709789.0
They gotta know Jerry!,2,jsdx5tf,Avatar,t3_152b0vi,t1_jsdl33s,1689636504.0
I was in the pool!,2,jseodl5,Avatar,t3_152b0vi,t1_jsdl33s,1689649330.0
"Your post/comment was removed, because it features NSFW/inappropriate content that is not permitted on r/Avatar.",5,jsd2xpn,Avatar,t3_152b0vi,t1_jsd24rx,1689624200.0
He's taller than me and my husband.,1,jsfznip,Avatar,t3_152b0vi,t1_jseoh5s,1689682126.0
"Same as Sam Worthington, they’re both same height, but they gave Stephen Lang character (Quaritch Avatar) a taller height than Jake Sully. 
Quaritch is 9’5ft tall and Jake is 8’11ft tall.",1,jsn9deg,Avatar,t3_152b0vi,t1_jseoh5s,1689802189.0
"Also Kiri isn’t fully grown, the kids are all shorter then their parents.",19,jselt96,Avatar,t3_152b0vi,t1_jse2xky,1689648061.0
"YeH, and i think also to make them a bit less blue compared to the other tribes",1,jsdliq5,Avatar,t3_152b0vi,t1_jsdgecf,1689631458.0
[deleted],1,jsdl8dm,Avatar,t3_152b0vi,t1_jsdkno9,1689631338.0
No taller,4,jsgjc6r,Avatar,t3_152b0vi,t1_jsfus1h,1689691380.0
"Pandora has very thick atmosphere for its gravity, with less gravity his spine would compress less but he'd have less need for dense muscles, generally lower gravity ---> tall but lanky higher gravity ---> short but built. But the extremely active parkour lifestyle, climbing flying mountains and stuff would probably combat the lower musculature stuff and climbing would be intense in Pandora's thick stewy atmosphere, way more to push/pull through, though bonus much softer falls.",1,khl1dx6,Avatar,t3_152b0vi,t1_jsfus1h,1705097781.0
"Not likely, we are built for ahigher gravity so we would evolve to be taller on that but native species would ceratinly have a different cardiovascular system so they may not need to be taller.",1,k8cb1lm,Avatar,t3_152b0vi,t1_jsgbdfe,1699440896.0
"I did too, probably because we know he's a teenager and we see him interacting the most with the Na'vi/avatars so it's just impossible to get a real feel for his height",5,jsh5pnd,Avatar,t3_152b0vi,t1_jse9fvy,1689700368.0
He was a teen when he filmed his role?,1,jsj2j2j,Avatar,t3_152b0vi,t1_jse9fvy,1689727933.0
"Thanks now it’s stuck in my head, ily",14,jsfgkzu,Avatar,t3_152b0vi,t1_jsf3a4h,1689668191.0
Lovely reference,6,jsfiiyb,Avatar,t3_152b0vi,t1_jsf3a4h,1689669843.0
Jake and his brother were twins,12,jsfp7um,Avatar,t3_152b0vi,t1_jsfj9hu,1689675336.0
"Jake and his brother were identical twins, so I think the height would be a little bit related at least",3,jsgb0fv,Avatar,t3_152b0vi,t1_jsfj9hu,1689687770.0
"I actually found a mistake on my part, I posted my un-revised version of it with Neytiri the same height as Jake, she’s actually 2 inches shorter at 9’10",2,jsfdk9p,Avatar,t3_152b0vi,t1_jsfcure,1689665685.0
The aren't.... They are alien,6,jsegr1z,Avatar,t3_152b0vi,t1_jse6wli,1689645579.0
"Might be hard to compare, their proportions are not human like. Just look at their necks.",14,jsd7lda,Avatar,t3_152b0vi,t1_jsd4tt6,1689625970.0
"The sources, please",4,jser8ns,Avatar,t3_152b0vi,t1_jsdkyjk,1689650800.0
"Which sources? You haven't linked anything yet. I find it hard to believe they were both equally 10 feet tall in the first movie, even if they were changed to be shorter in the second one.",2,jsf2nqc,Avatar,t3_152b0vi,t1_jsdkyjk,1689657535.0
But WetaFX (the people who made Neytiri) state she’s 3 meters tall. That’s 9 feet 10 inches. That’s also what is said to be one of the averages in the original visual dictionary. But now the average in the new disctuonary is around 8.5 feet,1,jshzqt0,Avatar,t3_152b0vi,t1_jshuocw,1689711789.0
"Ok, so for one of the sources I used for height was the 2009 avatar wiki page on fandom. I had to search hard for this one. That was for the average N’avi male. And it said 9-10 feet. Then for Neytiri I went to WetaFX. They stated that Neytiri is 3 meters tall, which is 9 foot 10. So I made Jake taller than her at 10 feet.",3,jsdmoa5,Avatar,t3_152b0vi,t1_jsdl8dm,1689631941.0
