body,score,id,subreddit,link_id,parent_id,created
"The Amrita plot is another macguffin on top of another macguffin that amounts to nothing.

I would rewrite the movie to show us what happened during the year skip. I would merge Lo'ak and Spider into one character so that Neteyam and Spider would be spirit brothers, Spider is the one befriending Payakan as he's an outcast for Omaticayas and Metkayinas all alike. We wouldn't know that Spider is Quaritch's son for sure until the final showdown. I'd show Spider sneakily escaping from the base but on Quaritch's volition to track down the Sullys.

I would cut down the kids wandering underwater down to one montage.

I wouldn't have made the final showdown happen at the 3 brothers rocks. I would have written the third act so Jake surrenders so he can free the kids. As the Seadragon goes back to Bridgehead, Neytiri and the whole family alongside the Metkayinas and Payakan decide to save Jake and Spider while both highjack the ship deciding to crash it on Bridgehead's gates in a suicide mission. Neteyam dies a martyr as he covers his dad during the final battle happening as the Seadragon is about to crash and Ardmore sends forces to prevent it.

Sully family goes back hiding to the rainforest at the end to bury Neteyam in the shrine of his ancestors to respect his last wish.",3,jglpi0u,Avatar,t3_12onyya,t3_12onyya,1681734157.0
"Only thing I would change is the story very clearly going down the jesus route with Kiri.

Just doesnt seem very imaginative to me.",3,jgmgpd1,Avatar,t3_12onyya,t3_12onyya,1681746474.0
That Neteyam didn’t die 💔,3,jgmvi8a,Avatar,t3_12onyya,t3_12onyya,1681752209.0
"I would have highlighted a bit more about Spider's experience growing up on Pandora to contrast Lo'ak. It would have been interesting to see Spider talking about his mom and giving the audience more information on who she was, just to give him a bit more depth. I know it's in the comics but for the people who didn't read them, just a simple scene or two would have made him easier to understand. If they had wanted the audience to believe that he was ""like a son"" or just trying to fit in, I would have liked to have seen him talking about his mom and trying to find that in Neyteri. 

I would have given more interactions with different characters to get a better dynamic on who they all were, especially the kids. I would have liked to have seen the older kids talking about how much pressure it is to live up to their father, for example. It also would have been nice to see more Ronal, especially since she wasn't sure about letting the family stay with them and bonding with Neyteri or maybe even Kiri. 

Also...I wish that Jake would have talked about how different Earth was to Pandora and how he grew up. Was his dad a hard ass with him and his brother? It would have been cool to know what he was like growing up and having a real talk with Neyteri or one of the kids on how he wanted them to have a better life than he did.",3,jgz7o6f,Avatar,t3_12onyya,t3_12onyya,1681966043.0
"For starters, I’d fire the entire marketing team that decided asking random internet children for directorial advice was a good idea.",5,jgl70ar,Avatar,t3_12onyya,t3_12onyya,1681720196.0
"If I could have a fan fiction alternative to Cameron's vision, I'd like to see one where humanity isn't so completely corporate barbarian in its behavior.

My reaction is that aside from a few ineffectual scientist types, almost every human is depicted as a soulless soldier/worker bee or is a dyed in the wool Corporate executive. Corporatists so concerned with profit that they can't even comprehend that their plans are morally objectionable.

The domination of that Corporatist extractive outlook is so complete that there seems to be not even a shred of Public Relations worry about the reaction of people back home to the genocidal depredations humanity is inflicting on its newest neighbors.

For example, that massive cargo module's landing mechanic is not going to be a secret. It could only be deployed in that fiery fashion. So attentive folks back in the Sol system would have had evidence of at least indifference to the damage such a technique would inflict on Pandora.

So I'd like Avatar to have been a little less simplistic in the 'humans bad' portrayal of things. At least to the point I'd expect bad stories getting back home would rile up some amount of legal controversy inconvenient to the Corporate types.

In other words, I'd like for the Uncanny Valley to not shift over to the humans from the CGI aliens.",2,jgks6pz,Avatar,t3_12onyya,t3_12onyya,1681708704.0
"Honestly it might sound fucked up but I think Quaritch should have killed a few Navi from the tribes he was raiding on the islands. Like that pregnant one he had pinned down. Do it in a way that the movie doesn't lose its PG-13 rating but also show that he is willing to do anything to find and kill Jake.

It would have made the scenes where he was holding the kids hostage much more intense and high stakes because you know he is willing to kill innocents if he believed it got him closer to capturing Jake.",2,jgm1mnb,Avatar,t3_12onyya,t3_12onyya,1681740166.0
"As someone who isn’t aware of Avatar Lore, the story didn’t make total sense. I’ve watched it 3 times now but maybe I missed things?? 

So did humans mine the metal under the big tree they destroyed? 

Neytiri got a new flying dragon pet after her’s died? I thought you only match with one for life, no? 

It wasn’t obvious when or how Spider was born because he must have been a toddler in the first movie but was never mentioned. They just made subtle hints at who his father was until you eventually put it together but they literally could have just said, ‘you’re not like Quaritch’. 

Also Spider’s character and personality. I *think* he’s supposed to be young (like 13?) and unsure of himself but instead he comes across as a spineless 20 year old. 
Him and Kiri are so close but we don’t see why and how close? Is this a romantic love or sibling love?
Maybe give him some pants once he’s captured. 

The whale going all Free-Willy was fun, I didn’t hate it but it was a *little* on the nose. 

It didn’t show when or why they killed the Tulkun calf. 

How anyone understands what the Tulkun are saying and how Lo’ak goes from not understanding either to suddenly being fluent in whale grunt. 

Where did the reef people disappear to in the fight? They literally peace out and left the Sully’s to die. 

Neytiri is portrayed too much as a moody, heartless heel dog. Was she actually going to kill Spider or just faking it? 

More on the recon’s for sure. I like them. Maybe a bit of something on how they deal mentally and emotionally with suddenly waking up as a different species and get told that they actually died 10+ years ago, they’ll never go back to earth, never see their loved ones (if they’re still alive) or now adult children. They were created solely to work and best strap up because we’re rolling out in 10.",2,jgmkrn7,Avatar,t3_12onyya,t3_12onyya,1681748057.0
"More scenes with Kiri and Spider,  how they met and how their relationship evolved",2,jgnp6mc,Avatar,t3_12onyya,t3_12onyya,1681763723.0
The one thing the immortality goo from the whale brains and I think it would have been cool to see the rda doing off shore oil rigging,2,jgojkw8,Avatar,t3_12onyya,t3_12onyya,1681776819.0
I would put a 5 min break in the middle of the theatre version so people could go pee,2,jgonhiz,Avatar,t3_12onyya,t3_12onyya,1681778545.0
I am not kidding more coffee drinking from exosuits,2,jgoxtiq,Avatar,t3_12onyya,t3_12onyya,1681783199.0
"More peaceful time in the forest. More time screen with Jake and Neytiri (in addition to the screen time with the kids that I deeply appreciate too !) More of Na’vi cultures, also, no one in the family dying. I still feel terrible for Jake and Neytiri to loose a son…

Also, the recoms bonding with ikrans. Absolutely hate this moment. They absolutely don’t deserve it.",2,jgl3ic1,Avatar,t3_12onyya,t3_12onyya,1681717083.0
[deleted],2,jgkt0og,Avatar,t3_12onyya,t3_12onyya,1681709257.0
The exploring the ocean scenes and tulkun hunting scenes drag on a little too long.,2,jgk2f3m,Avatar,t3_12onyya,t3_12onyya,1681695014.0
Make the RDA actually kill at least one relevant person so the movie isn't completely unrealistic.,1,jgk60uu,Avatar,t3_12onyya,t3_12onyya,1681696703.0
"Make it more nuanced and serious while still retaining some jokes. Replace Lo’ak with Neteyam. Neteyam gets a romance with Tsireya. 

More stuff with the Recoms and more Bridgehead. Recoms don’t die until the end. Jake leaves his family to go back to the forest to lead them away from his family. Jake surrenders himself to Quaritch. 

They get ambushed by the whole Meytkayina tribe near a giant river in the forest. Humans win. Jake is taken in as a prisoner. The end. This isn’t exactly what I wished happened I just thought these were cool ideas",2,jgj4061,Avatar,t3_12onyya,t3_12onyya,1681679690.0
More venture star Yknow. Like 30% of the movie would be a human tech circle jerk. I would have Quartitch give a 5 minute monologue on the anti matter engines. End of the movie ends with the humans glassing part of a continent with the exhaust,1,jgl1rpp,Avatar,t3_12onyya,t3_12onyya,1681715666.0
 I take half of Lo’ak’s  screentime and give it to Spider.,0,jgl1og5,Avatar,t3_12onyya,t3_12onyya,1681715593.0
L post L comments,0,jgl1zen,Avatar,t3_12onyya,t3_12onyya,1681715839.0
The less annoying brother should have lived xD,0,jgllf1w,Avatar,t3_12onyya,t3_12onyya,1681731761.0
"To me, I felt like I was watching an Outer Space version of Waterworld without Kevin Costner. I get it, James loves the oceans and all, but jeez, the RDA Fleet seemed like he ripped off the Smokers sequences.",0,jgtacja,Avatar,t3_12onyya,t3_12onyya,1681861272.0
Cut it to 1 hour movie instead of 3 hours.,1,jglnef3,Avatar,t3_12onyya,t3_12onyya,1681732947.0
I didn’t like the frame rate switching when watching the movie in hfr.,1,jgme874,Avatar,t3_12onyya,t3_12onyya,1681745498.0
"A LOT less time on that big ship-sinking battle at the end. It felt so, so long. Also, I do not think we needed \*that\* many kids to keep track of and try to develop at once!

More time with:

* Jake & Neytiri
* Back & forth knowledge-sharing with the sea people; the forest people have things to teach, too!
* More time for Neytiri to feel the grief she has to be feeling. Poor girl's been through it.

Also, I was very disappointed with the score for this movie. Horner did such a great job in A1 and it was just not really used well in this movie. That score is a huge part of why I loved A1 so much!",1,jgrrl4j,Avatar,t3_12onyya,t3_12onyya,1681839415.0
"So, a 10 hour movie?  :P",3,jgn7esv,Avatar,t3_12onyya,t1_jgjmzg4,1681756839.0
"So, you want a mini-series instead of a movie.  :)",3,jgn7jza,Avatar,t3_12onyya,t1_jgjmzg4,1681756895.0
"Your comment on more time with the recoms makes me kind of wish we actually had Michelle’s Trudy come back as an Avatar. I respect Michelle Rodriguez not wanting to be the “resurrected girl” over and over but that could’ve been a really cool subplot of her consciousness being cloned before, or even after, joining Jake’s crew in the first film.",10,jgkp5em,Avatar,t3_12onyya,t1_jgjhotj,1681706742.0
"Yeah more of the Recoms would be awesome. As you can see by my Avatar and tag, I liked the Recoms a lot. I was really looking forward to them before the movie released and kind of disappointed we didn’t really get much from them. Most of them died wayyy too early.",6,jgjskk4,Avatar,t3_12onyya,t1_jgjhotj,1681690586.0
"And Neytiri and Ronal interactions with Tonowari and Jake on fight diffusion guard, so we could see them slowly come to understand each other.",7,jglx40m,Avatar,t3_12onyya,t1_jgk37vl,1681738072.0
"Yes, I agree this part of the plot is ridiculous, I was like immortality syrup? They aren't going to say how much it is right? Then they did and it was worth so little money??",9,jglfjqe,Avatar,t3_12onyya,t1_jgkt5ef,1681727662.0
"Pandora having multiple ""appealing"" resources for Capitalism to exploit has always seemed like a rather deliberate set up for the reveal that ""Eywa"" wants humanity on Pandora for a reason. Some people take this as in the ""Eywa is evil"" direction, but that absolutely clashes with everything these movies gave established. I hold to the idea that Eywa wants humanity to come to Pandora more to ""redeem"" them than to punish. Combine this with ""Earth"" possibly having a similar planetary consciousness and things like Amrita just being ""bait"" honestly make a good deal of sense.",3,jgmtned,Avatar,t3_12onyya,t1_jgkt5ef,1681751490.0
I feel like that Cameron followed “put it in the plain sight so that nobody sees it” model with that plothole.,2,jgo2p61,Avatar,t3_12onyya,t1_jgjtwq8,1681769189.0
"Thisssss. I like Sig and she did a good performance but if they’re going to invest in the Spider-Kiri romance, they should have just got an actual teen. It would never feel right to me.",6,jgm29ti,Avatar,t3_12onyya,t1_jgm19ak,1681740460.0
"I was fine with Sigourney playing her but I wish they had made her voice higher, so Kiri didn't sound so old? I feel like that would have made a big difference.",1,jgz7ui6,Avatar,t3_12onyya,t1_jgm19ak,1681966156.0
Yeah that kinda confused me. They were gonna come anyways.,10,jgjs37n,Avatar,t3_12onyya,t1_jgjlndj,1681690373.0
"I thought the same thing and I think it’s because Quaritch wants to kill Jake himself. He lost a major battle to Jake and he caused his and his entire squad’s deaths. Jake lied and betrayed the mission to help humanity survive, and in the eyes of the military that’s the worst thing a person can do. 
To just head-shot him from afar wouldn’t be enough for Quaritch. Which is why he openly says he wants to not only kill Jake but kill his family, his innocent children too.",4,jgma1c0,Avatar,t3_12onyya,t1_jgjlndj,1681743718.0
I don't agree with point 3. Their 4 kids make it more understandable for Jake's running especially because of how different they are in there situation. 1 kids is much easier to protect and keep track of. The sibling dynamics are entirely different but help move the plot along. Even the relationship between each child and their parents and between Jke and Neytiri have become more complex.,4,jglxlmz,Avatar,t3_12onyya,t1_jglcz0c,1681738309.0
"I agree with you that death should’ve a meaning and help the story to move forward (that why neteyam need to stay six feet down lol). But expect for quaritch, wainfleet&co who are technically not the same as before, who have been brought back to death ? Kiri is not grace clone, she’s a whole new being. She won’t turn into grace when she’ll get older. Seems like you didn’t really like TWOW storyline but it’s fine I hope A3 will be better for everyone.",3,jgqs2tm,Avatar,t3_12onyya,t1_jglcz0c,1681825189.0
I wish we had a one on one conversation between Neytiri and Mo'at before they leave the clan without Jake involved.,4,jgny1km,Avatar,t3_12onyya,t1_jgnmq1c,1681767239.0
"It is... Interesting actually. 

First movie was ""I see you"" about seeing and understanding the ""other"".

""Way of the water"" is, I guess, anyone can understand on his own. My understanding is ""There is no beginning and no end. We are all born from water and return to water when we die. This is life."" Basically ""Way of the water"" Is not unlike our Earth Stoicism philosophy. 

Jake was afraid initially to lose his family and wanted to protect his tribe. He understood that fighting Sky People in big battles like last time - is pointless and suicidal now. Not even massive intervention by Eywa will help against plasma from orbit. 

But after losing his son, battle with Whalers, salvation by Kiri... Jake grew to accept that the fight is already happening. Running from fate is pointless and painful. So he accepted the way of the water and said ""Here we stand and fight no matter what"".",7,jgkuff7,Avatar,t3_12onyya,t1_jgkr5gd,1681710220.0
"Maybe a bit more thematic cohesion with the score... 🎶 Miss ya, Horner. 🥺",3,jgpufny,Avatar,t3_12onyya,t1_jgp353a,1681801947.0
Being an “indigenous alien” doesn’t mean loak shouldn’t act the way he does. He grew up around Na’vi and humans alike. Not to mention his father was human. Human characteristics are bound to rub off on loak and neteyam.,21,jgkb4cv,Avatar,t3_12onyya,t1_jgjpg9v,1681699125.0
"It is translated from Na’vi to English (in my case french) to us. They don’t literally say “bro”, probably “ma Tsmukan” in Na’vi or something like this.",6,jgl3mfz,Avatar,t3_12onyya,t1_jgjpg9v,1681717179.0
Yessss. I found this kind of annoying,5,jgjrzma,Avatar,t3_12onyya,t1_jgjpg9v,1681690329.0
This is the same movie franchise that has a grown man saying “get some” as 1/4 of his lines.,1,jgme0z7,Avatar,t3_12onyya,t1_jgjpg9v,1681745417.0
"Not gonna lie, I love this.",2,jgs1i5u,Avatar,t3_12onyya,t1_jglpi0u,1681843249.0
"If you are looking for a good fanfic thats a little bit pro humanity I recommend Semper Victoria on Fanfiction.com. The basic plot is that the UN seizes control of the RDA starfleet and sends an expedition to Pandora to save earth. Its very well written and also pretty realistic, easily the best fanfic I have ever read.",7,jgl61f2,Avatar,t3_12onyya,t1_jgks6pz,1681719318.0
"I think its onesided a bit in portrayal because of the monopoly the RDA has. The ONLY humans on Pandora are RDA humans, no other representatives (so PR is less of an issue, since Earth has a hard time finding out what really is happening) and those who come to Pandora are probably carefuly selected to be as RDA compliant as possible. 
And once back, people are probably not proned to leak whats happening on Pandora, because they were complicit in it as well?",4,jglap7w,Avatar,t3_12onyya,t1_jgks6pz,1681723565.0
"I feel like this is deliberate, RDA is supposed to represent everything wrong/evil with the world. Ultimately news of anything happening on Pandora is totally at RDA's control and they had 7 years to prepare the public through propaganda/disinterest to not care what really happens there/to the na'vi. Plus I suspect that the landing modules is just the start of what RDA has planned.

That being said Cameron has confirmed that A3 is going to change things up, showing off humans at their best and the na'vi at their worst for a change.",2,jgls4e1,Avatar,t3_12onyya,t1_jgks6pz,1681735582.0
"I don’t know if you’ve heard about the absolute atrocities that militaries across the world have committed over the centuries and even in modern times, but they went extremely light with it in the movie. 
Jake references it himself when he says something like ‘you see something you want so you make the indigenous people the enemy so you have justification to kill them and take it’… he’s referencing the war in the Middle East. I work with people who were front liners and the stories made my blood run cold.",2,jgmbw3v,Avatar,t3_12onyya,t1_jgks6pz,1681744501.0
"But the entire point of him not killing those clans was because SPIDER begged him not to. And Quaritch has been shown to want a sort of relationship with him, not wanting Spider to hate him. If Spider wasn’t there he would’ve absolutely slaughtered every single one.",1,jnrz63y,Avatar,t3_12onyya,t1_jgm1mnb,1686489607.0
"All these are simple answers  
1.yes,

2.the ikran only bond with one rider not the rider they can bond many times,.
 
3.the comics explain spider birth,

4. he’s 16 that’s why plus they have a s sibling like relationship she even calls him her brother 

5.they didn’t kill the calf it died without its mother 

They stayed there for months and learned the language.

6.James said they cut the  fighting because it 
took away from the family and the original viewing audience said the fight didn’t felt clunky

7.and of course neytiri not going to be happy she’s lost half the important people in her life . She just lost her son in that scene as well, and quartich was hurting kiri what else you want her to do",3,jgmyb54,Avatar,t3_12onyya,t1_jgmkrn7,1681753289.0
Remove Jake next will ya,2,jglf517,Avatar,t3_12onyya,t1_jgkt0og,1681727336.0
Literally the water scenes were good but they dragged on for way to long 😒they should have reduced that and have more characters more development,2,jgmvbr9,Avatar,t3_12onyya,t1_jgk2f3m,1681752140.0
"what are you talking about? the movie was pretty serious with a few jokes here and there. what's the point if replacing replacing lo'ak with neteyam the story will stay the same you're literally just acting like a neteyam fanboy 

most of the recoms died at the end and to be very honest in the grand scheme of things the only recoms that matter are quaritch and wainfleet 

this doesn't even make sense cos why are the metkayina evil now?? it's going to take alot more than that to capture jake lmaoo",2,jgklbtg,Avatar,t3_12onyya,t1_jgj4061,1681704442.0
Replacing Lo’ak and Neteyam doesnt change anything except for the looks,1,jgjf65m,Avatar,t3_12onyya,t1_jgj4061,1681684479.0
"Correct me if I'm wrong, but I believe their memories were stored prior to the final battle, at which point she was already on Jake's side, so at least it does make sense plot wise why she wasn't brought back as a recomb. I miss her though, I liked her character a lot",2,jgma9ha,Avatar,t3_12onyya,t1_jgkp5em,1681743811.0
it's true that your avatar looks like a Recom. It's funny x),3,jgkosuy,Avatar,t3_12onyya,t1_jgjskk4,1681706525.0
It would be an 'oh shit moment' if recom Trudy killed Bob,3,jgljbkd,Avatar,t3_12onyya,t1_jgjskk4,1681730400.0
"Or... You know. If the Lewis Space Trilogy or Albion the game is rough analogy, Earth indeed has an entity. And it is the Devil of the story. The real Big Bad.",1,jgmurir,Avatar,t3_12onyya,t1_jgmtned,1681751922.0
"My version of this is the Singularity happened on Earth, but the A.I.'s decided to skip town. As a departing gift/puzzle they terraformed a moon in the nearest star system with a whole ecology they'd simulated in-silico prior to printing into reality. 

Things like the Unobtanium of the first movie could be hints at such with the material being akin to an 'oops' on the part of the A.I. that needed a cheat to literally prop up something like the giant trees. 

That or every morally conflicted 'wonder' resource is a sort of test by the hidden creators - one to check on humanity's progress vs. the afflictions of the society the A.I. creators noped out from.",1,jgntz0e,Avatar,t3_12onyya,t1_jgmtned,1681765595.0
They had the kids,2,jgl1y8x,Avatar,t3_12onyya,t1_jgjs37n,1681715813.0
"I know kiri is not technically a grace clone, but I don’t rly like her ark. I wasn’t a huge fan of the story line but I know that the family orintated dynamic for A2 was a necessity to get us to care abt like 8 new characters and to set us up for the next films which I for one cannot wait for. Again, though it’s not going to my favourite avatar film at all, it was needed 100 percent. Goes hand in hand with he 3 hour run time, that shit was needed to tell us what James wanted to tell us.",1,jgtxfgw,Avatar,t3_12onyya,t1_jgqs2tm,1681871290.0
Okay add this too because this would be amazing to see!,2,jgo26a4,Avatar,t3_12onyya,t1_jgny1km,1681768952.0
Not to be that guy but when do you hear anyone apart from spider and lo’ak saying that,5,jgkx3id,Avatar,t3_12onyya,t1_jgkb4cv,1681712144.0
Same here.,2,jgjxdoj,Avatar,t3_12onyya,t1_jgjrzma,1681692701.0
I mean that’s what I’d expect from a war thirsty marine,2,jgme7o8,Avatar,t3_12onyya,t1_jgme0z7,1681745493.0
